product_title,cantidad_reseñas,promedio_score
Barrons Books Hop To It Rabbit Training Book,1,4.0
API Freshwater Algae Fix 8 oz,1,5.0
Vita-Chem Marine Saltwater,1,3.0
Vita-Chem Saltwater - 16 oz.,1,3.0
Barron's Publishing DBR1464 Beagle Handbook,1,5.0
Barrons Books All About your Pet Mouse Book,1,1.0
"API First Layer Pure Laterite Aquarium Planting Medium, 55-Ounce",1,5.0
Barrons Books Caiques Pet Owner Manual,1,4.0
Vita-Vittles For Gerbils - 5 Pounds,1,5.0
"Vita-Vittles Gold Food For Hamster - 2"" X 0.5"" X 0.5""",1,5.0
Super Pet Chilly Chews,1,5.0
Barrons Books Civilizing your Puppy Book,1,4.0
Vita-Vittles Parakeet Food - 5 Pounds,1,5.0
"API First Layer Pure Laterite Aquarium Planting Medium, 20-Ounce",1,5.0
Super Pet Camp-N-Out Tent,1,5.0
Barrons Books Dwarf Rabbits Family Pet Series,1,3.0
Barrons Books Guide to the Quaker Parrot,1,4.0
Vitakraft Australian Cockatiel Kiwi Sticks and 6.24-Ounce Bag,1,5.0
"Super Bird Creations Large Paper Lollipop Sticks, 25-Pack",1,3.0
Super Bird Creations Large BuzBee Bird Toy,1,4.0
Vitalmix multi-vitamins for Dogs and Cats 45 Chewable Tablets,1,1.0
"API Activated Filter Carbon, Pint Carton, Net Weight 5.5-Ounce",1,4.0
"Super Bird Creations 7 by 2-Inch Balsa Munch Bird Toy, Small",1,4.0
"Vitakraft Reptile Gammare, 5.2-Ounce Pouch",1,5.0
"Vitakraft Small Animal Wild Berry Drops, 250-Gram Box",1,2.0
Vitakraft Small Animal Yogurt Drops 250-Gram Box,1,5.0
"Super Bird Creations 5 by 1-Inch Mini Calamity Chain Bird Toy, Small",1,4.0
"Super Bird Creations 4-1/2 by 2-Inch Mini Paper Party Bird Toy, Medium",1,5.0
"Super Bird Creations 4-1/2 by 1-3/4-Inch Rattle Bird Foot Toy, Medium to Large",1,4.0
Vitakraft Super Fruit Cocktail and 20-Ounce Pouch,1,2.0
"Super Bird Creations 4 by 14-Inch Diamond Delight Bird Toy, Medium",1,5.0
Super Bird Creations Hanging Munch Ball Bird Toy,1,4.0
"Super Bird Creations 4 by 1-1/4-Inch ABC Barbell Bird Foot Toy, Medium to Large",1,2.0
Basenji Leash Holder,1,5.0
Vitakraft Treat Parakeet Fruit Stick -- 2 Pack,1,5.0
Vitakraft Tropical Fruit Variety Pack Sticks and 3.17-Ounce Bag,1,5.0
"Super Bird Creations 20 by 10-Inch Block Buster Bird Toy, X-Large",1,1.0
Vitakraft Waffles Small Animal Treat,1,5.0
Basket Muzzle Size 10 (Xlarge),1,5.0
"Super Bird Creations 15 by 5-Inch Whiffle Fingers Bird Toy, Medium",1,5.0
"Super Bird Creations 7 by 3-Inch Vine Ball Ring Bird Toy, Small",1,1.0
Vitakraft Rabbit Honey Sticks and 4-Ounce Bag,1,5.0
"Vitakraft Rabbit Happy Frutti, 6-Ounce Pouch",1,5.0
"Super Bird Creations 7 by 4-Inch Sputnik Jr Bird Toy, Small",1,5.0
Super Bird Creations Crazy Daisy Bird Toy,1,4.0
Super Bird Creations Coco Bell 11in x 7in Large Bird Toy,1,5.0
Super Bird Creations Cactus Slices each Bird Toy or Toy Part,1,5.0
Super Bird Creations Bead Swing Bird Toy,1,5.0
"Super Bird Creations 9 by 7-Inch Snuggle Ring Bird Toy, Medium",1,4.0
"Super Bird Creations 9 by 5-Inch Fiesta Spoons Bird Toy, Medium",1,5.0
Vitakraft Parakeet Treat Sticks Kiwi,1,5.0
Barrons Books Red Tailed Boas and Relatives Book,1,5.0
Vitakraft Peanut Butter Snack for Dogs 8 oz.,1,5.0
"API Ammo-Carb, Quart Carton, Net Weight 18-Ounce",1,5.0
Vitakraft Premium Menu Rabbit Food,1,5.0
Vitakraft Pro-Feda Complete Moulting Aid 3.38 fl.oz.,1,5.0
"Super Bird Creations 8-1/2 by 3-Inch ABC Spoon Stack Bird Toy, Medium",1,5.0
"API Ammo-Carb, Pint Carton, Net Weight 9-Ounce",1,5.0
Barrons Books Spiny Tailed Agamids Uromastyx and Xenagama Book,1,2.0
Barrons Books Training Your Pit Bull,1,1.0
"API Algaefix Algae Control, 8-Ounce",1,1.0
Beef Street Boyz Masta Pee 36,1,5.0
"Stewart OBEY Training Treats for Dog, Small - 20 oz Box",1,4.0
Vo-Toys Chilly Bone Canvas Dog Toy,1,1.0
Bellies Penguin Dog Toy,1,2.0
Vo-Toys Looks So Real Mouse Cat Toy,1,5.0
Vo-Toys Maze Seed and Waterer for Birds,1,3.0
Vo-Toys Mice n Coils Cat Toy,1,3.0
Bella Romance Rhinestone & Roses Cat or Dog Collar : Color PINK VINYL W PINK & WINE ROSES : Matching Lead MATCHING 4 FOOT LEAD : Size 8 INCHES,1,4.0
Spray-On Waterless Shampoo - 12 oz,1,1.0
Bella Romance Rhinestone & Roses Cat or Dog Collar : Color PINK VINYL W PINK & WINE ROSES : Matching Lead NO MATCHING LEAD : Size 12 INCHES,1,5.0
Vo-Toys Millet Holder for Birds Assorted Colors,1,1.0
Bellies Bear Dog Toy Size: Medium,1,5.0
Bench Warmer for Midwest Cat Playpen Model 132 : Size ORDER THIS ITEM,1,1.0
AG MEGAFLOW FILT MEDIA MODEL 3 & 4 (3PK),1,5.0
Vo-Toys Mini Tennis Cloth Mice 3 pack Cat Toy,1,5.0
"Bene-Bac Bird & Reptile Powder, 10oz",1,2.0
AIR KONG FOOTBALL SM 48,1,5.0
Spotbrites Glo-Brite Led Safety Dog Collar (Small 9 - 14),1,1.0
Spotbrites Glo-Brite Led Safety Dog Collar (Medium 17 - 23),1,5.0
Vo-Toys Mosiac Neon Bell Balls 2 pack Cat Toy,1,1.0
Spot on Puppy 4months Under 15 Pounds Flea Control,1,1.0
Vo-Toys Multicolor Squeaky Fur Snake Cat Toy,1,5.0
"Spring Clips for 2211, 2213, 2215 and 2217 Canister Filters",1,5.0
Bell Bottle - 8 oz.,1,5.0
Bell Bottle - 4 oz.,1,5.0
Vo-Toys Little Wings Plastic Geometric Chain Large Bird Toy,1,2.0
Vo-Toys Latex Spiney Pacifier Dog Toy,1,5.0
St Louis Cardinals Adjustable Dog Collar (Small),1,5.0
"Beefeaters Top Choice Pork Lungs, 10oz",1,5.0
Beefhide Bulk Dog Bone,1,4.0
Vo-Toys Latex Stuffed Gigantic Blue Devil Dog Toy,1,4.0
Squeakin' Eggs Bag,1,5.0
Squeaker Mat - Pink/Purple Medium,1,1.0
Squeaker Mat - Pink/Purple Large,1,5.0
"Squatter Rabbit Dog Toy, Large",1,3.0
Vo-Toys Latex Stuffed Gigantic Orange Fullback Dog Toy,1,2.0
Spruce Intergrooved Wood Scratching Post in Sandstone Beige,1,5.0
AIR KONG MED TENNIS FOOTBALL AKFB2,1,4.0
Vo-Toys Latex Stuffed Knobby Socker Dumbbell Dog Toy,1,5.0
Vo-Toys Latex Stuffed Knobby Tennis Dumbbell Dog Toy,1,5.0
Vo-Toys Latex Stuffed Knobby Volleyball Dumbbell Dog Toy,1,5.0
Vo-Toys Latex Tigers Assorted Dog Toy,1,4.0
Vo-Toys Latex Tiny Tails Mini Creepy Crawlers Dog Toy Colors May Vary,1,5.0
"Bene-Bac Bird Plus Prebiotic Gel, Pro Pack, 15gm",1,5.0
Spot Organics Chill Calming Dog Spray,1,4.0
Vo-Toys Chomp Meat Bone Smoked Ham Bone 8in Shrink Wrapped Dog Bone,1,1.0
Vo-Toys Seed Cup with Bird Perch Bird Toy Assorted Colors,1,5.0
"Bergan Connect-a-Bowl, Small",1,4.0
Vo-Toys Rope N Tug Figure 8 Dog Toy with 2 Tennis Balls,1,1.0
Bergan Out Post Medium Dog House,1,3.0
"SportDOG 7.5"" Antenna",1,5.0
Sport Upland,1,5.0
Sport Pet Dog Kennel * LARGE * Pop Open,1,5.0
Vo-Toys Safty Pet Nail Clipper,1,1.0
Sporn Stop Pull Halter - 10044 - Bci,1,5.0
Vo-Toys Seed and or Treat Cup 12 count Display for Birds or Small Animals,1,5.0
Vo-Toys Parakeet Chimes Bird Toy,1,5.0
ADL Foaming Ear Cleanser - 4 oz,1,4.0
Vo-Toys Soft and Cuddle Plush Animals Assorted Dog Toy Each,1,5.0
Bergan Purple Martin House,1,1.0
Bergan Stack-N-Stor Pet Food Storage Container,1,3.0
Vo-Toys Sport Frontpack 10lb Small 11in x 6in x 11in,1,3.0
"Sporn Pet Halter, Large, Blue",1,3.0
Vo-Toys Stainless Steel Parrot Cup with Bolt 12oz,1,1.0
Berry Clean Dirty Pet Shampoo - 20 oz,1,3.0
Vo-Toys Ring Forest Toucan Plush Dog Toy,1,5.0
Vo-Toys Pole Toy with 2in Two Tone Longhair Mouse Cat Toy,1,2.0
"SportDOG SD-2000 Replacement Transmitter, SDT00-10804",1,1.0
Vo-Toys Plush n Fuzz Balls 3 pack Cat Toy,1,4.0
Vo-Toys Parakeet Perch,1,4.0
Spot HI-TECH Aquarium Air Pump 380 for 30 to 80 Gallon Tank,1,5.0
Spot Ethical Pet Triple Skull Sand Fountain,1,5.0
Spot Ethical Pet Mermaid With Conch Sand Fountain,1,4.0
Spot Ethical Pet Gun Powder Keg Sand Fountain,1,5.0
Vo-Toys Placemat Bone Motif 17x11in,1,5.0
Bene-Bac Plus Gel for Bird & Reptile (15 grams),1,5.0
"Sporty K9 New York Yankees Pink Dog Collar, Small",1,5.0
Vo-Toys Plastic 2 Story Hamster House,1,5.0
Sportsman Bell,1,2.0
Vo-Toys Plastic Canary Bird Nest Assorted Colors,1,5.0
Vo-Toys Plastic Hamster Maze Translucent Set 3 pack,1,4.0
Vo-Toys Plastic Hamster Translucent Play Boot,1,1.0
Beneful Original Dog Food 3.5 lb,1,1.0
Vo-Toys Platinum Crinkle Balls 4 pack Cat Toy,1,5.0
Vo-Toys Plush Long Leggers Monkey Dog Toy,1,5.0
Vo-Toys Plush Speckles n Spots 7 in Dog Toy,1,5.0
St. Jon Bizzy-Kitty Scratching Pad with Catnip,1,5.0
Beefeaters Top Choice Lamb Lungs,1,1.0
Vo-Toys Latex Soccer Ball Small Dog Toy,1,4.0
Vo-Toys Finch Nest Hemp 4x4in,1,5.0
Stella Fontinella - 1 lb,1,5.0
"Steel Choke Chains - X-Fine 12""",1,5.0
Vo-Toys Ferris Wheel Tum Balls Bird Perch,1,5.0
"Steel Choke Chains - Medium 20""",1,3.0
Vo-Toys Fetch N' Cuddle Fleece Rabbit,1,5.0
Vo-Toys Fetch-n-Cuddle Fleece Man 9in Dog Toy Assorted Colors,1,3.0
"Steel Choke Chains - Heavy 30""",1,1.0
"Steel Choke Chains - Heavy 28""",1,1.0
Vo-Toys Flea Comb Small Blister Pack,1,2.0
"Stability, 100 mL / 3.4 fl. oz.",1,5.0
Stealth Airline Tubing - Shiny Black - 8 ft.,1,5.0
Beefeater Cheese and Bacon Twist Stix 5-Inch (Pack of 12),1,1.0
Staywell Premium Pet Door : Size LARGE - BROWN,1,1.0
"Staywell Plastic Dog Door, Medium",1,2.0
Vo-Toys Fresh Face 4oz,1,5.0
"Beefeaters Assorted Flat Chews, 75-Pack",1,5.0
"Vo-Toys Glow N' Throw Frog - 5""",1,1.0
"Beefeaters Chicken Knotted Bone, 9 to 10-Inch",1,3.0
BeefEaters Twist Sticks 75 Count Chicken,1,4.0
"Step-In Adjustable Harness Extra Small 3/8"" Width Red",1,5.0
"Step-In Adjustable Harness Medium 3/4"" Width Black",1,5.0
"Step-In Adjustable Harness Medium 3/4"" Width Blue",1,4.0
AKC Baltimore Oriole with Tennis Ball Inside Dog Toy with Bell and Squeaker,1,5.0
Vo-Toys Cockatiel Perch 2 pack Size approx 13.25in,1,5.0
Sterile Surgical Blade - Size 10,1,5.0
Stephanies Canopy Pet Bed : Fabric EBONY TOILE : Frame Color BLACK : Size SMALL,1,5.0
"AKC All Natural Biscuits, Peanut Butter, Small Dog, 18-ounces",1,5.0
Step-In Pet / Dog Harness - Teacup - Red,1,3.0
Step-In Pet / Dog Harness - Medium - Step 2 Brown,1,4.0
Step-In Pet / Dog Harness - Medium - Red,1,5.0
Vo-Toys Cotton Rope Chew Ball 3.5in Dog Toy Assorted Colors,1,3.0
Step-In Pet / Dog Harness - Extra Small - Forest Green,1,5.0
Step-In Pet / Dog Harness - Extra Small - Blue,1,5.0
Vo-Toys Cuttlebone with Metal Clip for Birds,1,5.0
Vo-Toys Double Patners Ace Chimp with Rope Dog Toy,1,2.0
Vo-Toys Fancy Bird Bath with Mirror Assorted Colors,1,4.0
Vo-Toys Ferret Hanging Play Den,1,1.0
"Step-In Adjustable Harness Small 5/8"" Width Black",1,4.0
"Step-In Adjustable Harness Medium 3/4"" Width Purple",1,5.0
Beefeaters DBF7595 Piggy Rope Bone 5-Inch,1,5.0
Star Plastic Folding Dog Crate 36L,1,5.0
Vo-Toys Grass Finch Nest 4x4,1,4.0
Vo-Toys Kitty Combo Fur and Plush Mice Cat Toy Assorted Colors,1,3.0
Vo-Toys Latex A Day at the Beach Frog Dog Toy,1,5.0
"Beefeaters Piggy Twists Stix, 5-Inch",1,5.0
Stainless Steel Bucket Pail - 1 Quart,1,5.0
Stainless Steel Bowl 2 Quart,1,4.0
Vo-Toys Latex Accordian Clown Dog Toy Assorted Colors,1,5.0
Vo-Toys Latex Chicken in Shell Dog Toy,1,5.0
Stainless Steel Bowl 1 Quart,1,5.0
Stainless Steel Aquarium Thermometer,1,3.0
"Beefeaters Tasty Spots Chkn Bone 8""",1,5.0
Vo-Toys Latex Flower Ball Medium Dog Toy Assorted Colors,1,5.0
Stack-n-stor Food Storage-65lb,1,5.0
Vo-Toys Latex Gigantic Toad Dog Toy,1,5.0
"Beefeaters Top Choice Femur Bone, 15 to 18-Inch",1,4.0
Vo-Toys Latex Mailman Dog Toy,1,1.0
Vo-Toys Latex Pig Xsmall Dog Toy,1,5.0
Vo-Toys Latex Shoe and Hydrant 2 pack Dog Toy Assorted Colors and Styles,1,5.0
Vo-Toys Latex Soccer Ball Assorted Colors Dog Toy,1,5.0
AIR KONG MEDIUM DONUT/RING ADD2,1,5.0
Stainless Steel Coop Cup - 30 oz - Style A with Wire Dish Holder,1,5.0
Beefeaters Hickory Smoked Cuisine Rawhide Bone,1,5.0
Stainless Steel Coop Cup with Hanger - 48 oz,1,1.0
Vo-Toys Grrr-emlins Hornelius Dog Toy,1,5.0
Vo-Toys Grrr-emlins Pedey Dog Toy,1,4.0
"Stansport Collapsible Dog Bowl, Multi (Colors May Vary)",1,5.0
"Standard Nylon Muzzle For dogs 70-100 lbs - 8"" Burgundy",1,3.0
"Standard Nylon Muzzle - Toy Poodle For dogs 5-10 lbs - 4.5"" Silver",1,4.0
"Standard Nylon Muzzle - 3 1/2"" for Dogs up to 5 pounds",1,1.0
Vo-Toys Grrr-emlins Slugger Dog Toy,1,5.0
Standard Holdguard - 16 oz.,1,4.0
Beefeaters Natural Rawhide Bones Value Box 4In-5In,1,5.0
AIRLINE SUCTION CUPS 10PK,1,3.0
Stainless Steel Pet Dish - 10 quart,1,5.0
Beefeaters Natural Rawhide Bones Value Box 6In-7In,1,5.0
Vo-Toys Hamster Slumber Den,1,5.0
Vo-Toys Hemp Canary Nest 4x4in,1,4.0
"Vo-Toys Hot Dog Princess Poodle Dog Toy, 13-Inch",1,4.0
Vo-Toys Inc Plush Jack Dog Toy 62091 Cat & Dog Toy,1,5.0
Stainless Steel Double Diners 2 quart,1,5.0
Tetra Reptofilter Cartridge 3pack,1,4.0
Comfort Zone With D.A.P. For Dogs Spray 60ml,1,2.0
"Cadet Stuffed Sterilized Bone for Dogs, Cheese, 5 by 6-Inch",1,2.0
"Marina Aquarium Showcase Bulb, 15-Watt, 120-Volt, Clear",1,5.0
Fish & Aquatic Supplies Pondgard Boxed Liner 8X10ft,1,5.0
Fish & Aquatic Supplies Pro Iiie Filter Pad Pack (1 Blue/4 White),1,5.0
Fish & Aquatic Supplies Resin Ornament - Blue Ring Octopus,1,3.0
Marina Coarse Nylon Catch Net in Black,1,5.0
Fish & Aquatic Supplies Suction Cup W/Clip 594,1,5.0
Fish & Aquatic Supplies Triple Flow Corner Filter Small Boxed,1,4.0
"Marina Aquascaper Plastic Plant, Red Ludwigia, 4-Inch tall",1,3.0
"Marina Aquascaper Plastic Plant, Cardamine, 4-Inch tall",1,5.0
"Marina Aquascaper Plastic Plant, Anacharis, 4-Inch tall",1,4.0
Fish Mate Pump Service Kit for 600 Pump,1,5.0
Fishing Pole,1,1.0
"Marina Aquarium Showcase Bulb, 25-Watt, 120-Volt, Blue",1,1.0
Fishpond Bow Wow Travel Water Bowl,1,4.0
"Mardel Live pH In-Tank Meter Aquarium Water Testing, Three Pack",1,3.0
Marina Amazon Sword Plant Decoration,1,4.0
Fit-Nip Treat-Ums 1.75 oz,1,5.0
Marina 5 Inch Blue Fine Nylon Net with 10 Inch Handle,1,4.0
Marina 5 Inch Black Coarse Nylon with 16 Inch Handle,1,2.0
Flame Red Bloom Hummingbird Feeder by Par-A-Sol,1,5.0
Marina 2 Inch Black Coarse Nylon with 10 Inch Handle,1,5.0
"Flashing Safety Pet Collar 12""-16""",1,1.0
"Marina ""Nova"", Fahrenheit only, 72 to 86-Degree Fahrenheit",1,1.0
"Marina ""Minerva"", 66 to 86-Degree Fahrenheit / 19 to 30-Degree Celsius",1,3.0
"Marina "" Diameterolphin"", 68 to 86-Degree Fahrenheit / 20 to 30-Degree Celsius",1,1.0
Flat Sided Stainless Steel Pail 9qt,1,5.0
Mardel Marplex Freshwater & Saltwater Conditioner,1,4.0
Marina Goldfish Kit UL - Purple - Medium,1,4.0
Marina LED Light Unit for Betta and Goldfish Kits w/cUL Adapter,1,5.0
Fish & Aquatic Supplies Novaqua & Amquel 1Oz Conditioner Kit,1,5.0
Fish & Aquatic Supplies Koi Growth Plus,1,5.0
Marineland Emperor 280 Hang-On Filter,1,5.0
Firstrax Noztonoz KC-100 Kitty Cradle Assorted Print Cat Bed,1,5.0
Fish & Aquatic Supplies 2 Gallon Fishbowl Undergravel Filter,1,3.0
Marineland Aquaria Motor System tem 6,1,1.0
Marineland Aquaria Media Container Emperors,1,5.0
Marineland Aquaria Bio Wheel Bearings,1,5.0
Marineland Aquaria Bio Wheel Assembly Penguin 100B #50434,1,5.0
Fish & Aquatic Supplies 5.5Gal Tank Black 16X8x10,1,4.0
Fish & Aquatic Supplies Airstone For Berlin Skimmers 3Pk,1,2.0
"Marineland 0048001 Duetto Filter Cartridge, 2-Pack",1,4.0
Marineland (Aquaria) Lamp Base Assembly For Eclipse 1,1,5.0
Marineland (Aquaria) Filtration Access Lid - Eclipse 6,1,5.0
Fish & Aquatic Supplies Bio - Wheel Assembly - Emperor 280/400/Ecl 2,1,5.0
"Marina Thermometer Suction Cup, Small, 2-Pack",1,5.0
"Marina Thermometer Suction Cup , Large, 2-Pack",1,1.0
Marina Sunken Galleon Ornament,1,3.0
Marina Standing Thermometer,1,3.0
Fish & Aquatic Supplies Blood Worms Frozen Flat Pak,1,5.0
Marina Shipwreck Ornament - Beached Boat - 6.5 Cm X 12.5 Cm X 7.5 Cm - Assorted (Blue Or Green Only),1,5.0
Marina Plastic Thermometer with Suction Cup,1,2.0
Fish & Aquatic Supplies Clown Fish Vegi - Clip With Suction Cup - 6 Per Bag,1,1.0
Marina Planting Rock,1,5.0
Marina Pearlscaper Cardamine Plant in Blue,1,1.0
"Marina Ornament Pirate Skull, Large",1,3.0
Fish & Aquatic Supplies Coppersafe Fw/Sw,1,1.0
"Flatulence Preventer by PetAlive - Natural Treatment for Bloating, Flatulence & Abdominal Cramps in Dogs and Cats",1,4.0
Flea & Tick Pyrethrin Dip - Gallon,1,1.0
Firstrax Action Scratcher Post - Colors May Vary,1,4.0
"Maine Coon, Standing - Lifelike Plush|One Size - 24 inches",1,5.0
Flexi Durabelt Extra Long Leash - Medium 16' in Blue,1,4.0
Flexi Durabelt Leash 16 ft - up to 150 lbs in Black,1,4.0
Majestic Pet 48-Inch Charcoal Crate Pet Bed Pillow,1,2.0
Majestic Pet 42-Inch Honey Crate Pet Bed Pillow,1,3.0
Majestic Pet 42-Inch Charcoal Crate Pet Bed Pillow,1,5.0
Flexi Durabelt Leash 16 ft - up to 150 lbs in Red,1,5.0
Majestic Pet 36-Inch Charcoal Crate Pet Bed Pillow,1,5.0
Flexi Explore Extra Long - Medium 26' in Blue,1,4.0
"Majestic Pet 32-Inch Bagel Bed for Pets, Red",1,5.0
Majestic Pet 30-Inch Charcoal Crate Pet Bed Pillow,1,5.0
"Majestic Pet 28-Inch by 35-Inch Super Value Pet Bed Medium, Burgundy",1,2.0
Majestic Pet 24-Inch Honey Crate Pet Bed Pillow,1,5.0
Flexi Explore Extra Long - Medium 26' in Granite,1,5.0
Flea Stop Shampoo W/linaloon 12 Fl oz,1,5.0
Magnet Impeller Assembly for Whisper 1 & Whisper 30 Filters,1,5.0
Flexi Explore Soft Grip Extra Long - Small 26' in Red,1,5.0
"Magnador 11"" x 13""",1,4.0
Flexi Freedom Soft Grip Retractable Leash - Medium 16' in Granite,1,4.0
Flexi Giant Leash - 26 foot - Blue,1,3.0
Magic Mirror Window,1,4.0
Magic Coat Freshening Spray - Fresh Essence,1,1.0
"Flexi Leashes Classic #2, Up to 44 lbs., 16 Feet, Purple",1,5.0
Magic Aquarium Ball,1,1.0
Flexi Medium Blue Retractable Cord Leash-16ft-Up to 44 lbs,1,5.0
Flexi Retractable Tie-Out for Dogs 10 - 77 lbs,1,2.0
Flexi Small 23ft Retractable Lead For Dogs Up To 26 Lbs. (Black),1,5.0
Flexi Durabelt Extra Long Leash - Medium 16' in Black,1,5.0
Flexi Compact 2 Red,1,1.0
"Flexi Comfort Belt 16-Feet Small Leash, 44-Pound, Red/Black",1,5.0
"Flexi Comfort Belt 16-Feet Large Leash, 150-Pound, Red/Black",1,5.0
Flea comb with Handle,1,3.0
Marchioro (GOA-C) Plastic Litter Pan with Rim and Feet,1,5.0
Fleecy Cleans 3 Knot XL Bone,1,4.0
Marchiori Feeding Kiosk for Pets : Size LARGE - WITH BOWLS,1,5.0
Marc Weis Reef Bugs,1,5.0
Maracide 2 oz,1,5.0
Maraca Munchie Bird Toy,1,5.0
Fleecy Giraffe Dog Toy w/ Squeaker - Natural,1,5.0
Mammoth Tirebiter Pawtrack Small 6in,1,1.0
Mammoth Original TireBiter Bone,1,1.0
"Mamas Boy Tee Dog T-Shirts Size: XSmall: 10"" L [Misc.] [Misc.]",1,5.0
"Flexi All Belt Large Retractable Lead For Dogs Up To 150 Lbs. (Black, 16')",1,4.0
Flexi Brush - 48 in.,1,3.0
Male Doggy Wrap Black - Large,1,5.0
Flexi Chew Chicken Bone - Souper,1,4.0
"Malaysian Driftwood - SMALL 5-10""",1,5.0
"Malawi/Victoria Buffer, 4 kg / 8.8 lbs",1,5.0
Flexi Chew Chicken Flavor - Giant,1,2.0
Flexi Classic 2 Black,1,5.0
Flexi Classic 2 Medium Retractable Cord Dog Leash - Red,1,5.0
Flexi Classic Medium 16' Retractable Lead For Dogs Up To 44 Lbs. (Black),1,4.0
Flexi Comfort - Large - 110 lbs - Purple & Black - 16 FT,1,5.0
Malacetic Spray Conditioner - 16 ounces,1,5.0
"MalAcetic Otic, 4 oz",1,1.0
Majesty's HA Wafers Joint therapy for high performance horses 60 count bag,1,4.0
Firstrax Carpet Chase - Colors May Var,1,3.0
Marineland Labs Bio-Blend Cichlid-Large Fish Food 8.48 oz,1,4.0
Lee's Shedding Stump for Herps,1,5.0
"Master Grooming Tools Steel Teeth Ergonomic Pet Grooming Comb with Rubber Handle, Medium, 8-Inch",1,4.0
"Max Puppy Chicken, Lamb and Rice Formula Puppy Food Cans, 5-1/2-Ounce",1,3.0
"Max Mini Bones Biscuits, 23-Ounce",1,5.0
Fat Cat Kitty Hoots Spiral Note Pad Cat with AppeTeasers Teenie Sardini,1,4.0
"Max Cat Senior Chicken and Lamb Formula Cat Food Cans, 5-1/2-Ounce, 24 pack cans",1,5.0
"Max Cat Seafood and Tomato Bisque Chunks in Sauce Cat Food Cans, 3-Ounce, 24 pack cans",1,5.0
"Max Cat Chicken Supreme Entre Chunks In Sauce Cat Food Cans, 3-Ounce, 24 pack cans",1,5.0
"Max Cat Beef and Egg Entre Chunks in Sauce Cat Food Cans, 3-Ounce, 24 pack cans",1,5.0
"Max & Lucy, Plush Grrregory, Large",1,5.0
Fat Cat Kitty Hoots The Incredible Flying RATaTeenies Alfredo Fetutuccine,1,4.0
Fat Cat Kitty Hoots The Incredible Flying RATaTeenies Tina Tortellini,1,5.0
"Fat Cat Tail Chaser Cat Toy, Hareball",1,4.0
"Favorite Pet Products Tiger Dreamz Trundle 3 Way Bed, Black Forest Cake",1,4.0
Feather Tether Bird Harness Ice Blue Large,1,5.0
Feathered Phonics The Easy Way To Teach Your Bird To Speak Volume 5: The International Edition,1,5.0
"Master Grooming Tools Pet Contoured Grip Flea Comb, 3-Inch",1,4.0
Master Grooming Tools 20-Blades Ergonomic Pet Dematting Rake,1,2.0
"Martingale Show Lead - Medium 10"" - Red",1,5.0
"Martingale Show Lead - Medium 10"" - Black",1,3.0
"Martingale Show Lead - Large 12"" - Brown",1,5.0
FeatherBrite Large Swag Light with 2 15w full spectrum bulbs,1,5.0
Feathered Phonics DVD Taming Training and Tricks,1,5.0
Feathered Phonics Teach Your Parrot Series DVD 1: Fantastic Performing Parrots,1,5.0
Marshall Plush Treat Holder,1,4.0
Marshall Pet Peter Rabbit Wound-aide 4oz,1,5.0
"Marshall Pet Marshall Premium Ferret Diet, 26-Ounce Carton",1,4.0
Marshall Pet Kage Klips 5pk,1,2.0
"Max's Closet Red Belly Bands, Medium",1,4.0
Maxi Derm EFA - 60 Capsules,1,5.0
Maxima 128 - Gallon,1,5.0
Maxima 256 - Gallon,1,3.0
"MediumWeight Trolley Exerciser, 50-Feet, Red",1,5.0
"MediumWeight Trolley Exerciser, 100-Feet, Red",1,5.0
"Medium Weight Tie-Out Ground Stake & Cable, 15'",1,5.0
Medium Terry Duck Dog Toy,1,5.0
Medium Reversible Happy Birthday Girl Dog Bandanna,1,5.0
Fat Cat Kitty Hoots Awful Mad Kitty's Catnip Couture Rat Sak,1,2.0
Medium Plexidor Pet Door / Dog Door for Doors (White),1,5.0
Medium Memo Dog Bowl - More Food Please,1,5.0
Medium Heated Pet Bed,1,4.0
Medium Hanukkah & Snowflake Dog Bandanna,1,5.0
Fat Cat Kitty Hoots Awful Mad Kitty's Catnip Couture Tuna Tote,1,5.0
"Medium Choke Chain Collar Size: 22""",1,1.0
Medium Casual Canine Gingham & Terry Duck Appliqued Bathrobe,1,5.0
"Medium Bone Kong Air Dog Toy (Yellow, 6.25 in.)",1,5.0
"Medium Bitches Britches (Black, Fits 11 to 20 lb. dog)",1,2.0
Fat Cat Kitty Hoots Big Mama's Scratchy Box Slim Flower,1,5.0
Fat Cat Kitty Hoots Blank Cards Cat,1,5.0
Medicated Shampoo - 12Oz,1,5.0
"Meaty Bone Training Treats, 16-Ounce Package",1,4.0
"Meaty Bone Dog Biscuits, Large, 6 Pound",1,5.0
Meadow Mints Horse Treats - 99208 - Bci,1,5.0
Mc Natural Orgnc Citrus Shmpoo 12 Ounce Package - Part #: 10670,1,1.0
Mazuri Koi Nuggets,1,1.0
Fat Cat Kitty Hoots Cat Bed Regular Purple,1,5.0
Fat Cat Kitty Hoots Cat Bowl Purple,1,5.0
Marshall Pet Ferret Flea Shampoo 8oz,1,2.0
Marshall Pet Deluxe Corner Lounge Assorted Colors And Prints,1,3.0
"Firehose Tug - 1.5"" X 0.25"" X 0.25"" - Red And Black",1,5.0
"Fido Fleece Tuscan Dog Jacket, Size 14",1,5.0
Fencemaster 10X10x6preferred Kennel 610106 Pet Carrier/Crate/Kennel,1,5.0
Ferret Cage - Super pet ferret 4/story white 32x20x30,1,1.0
Ferret Ear Cleaner,1,5.0
Ferret Glow Shampoo 12Oz,1,2.0
Ferret Glow Shampoo 12oz,1,2.0
Ferret Glow Shampoo 6 oz,1,2.0
Ferret Glow Shampoo 6oz,1,2.0
Ferret-Off Spray (8 oz),1,5.0
Ferretrail Comf-e-cube,1,5.0
"Fido - Beef Flavored - Medium - Extra Tuff 6 1/4""",1,4.0
"Fido - Beef Flavored - Medium - Nylon Tuff 6 1/4""",1,5.0
"Fido Fleece Cloud Bed - Petite 20.5 x 17.5 Green, for Dogs",1,5.0
Figuerola JointSaver 1 lb,1,5.0
Marshall Medium Ferret T-Shirt,1,1.0
Fiji Gold Coral and Live Rock Supplement 100% Coral Calcium 20 oz,1,1.0
"Marineland PA11482 Canister Filter Polishing Filter Pads, 2-Pack",1,4.0
"Filled Bone - Peanut Butter 3""",1,4.0
"Filter Media Bag Size: 12"" W x 4"" D",1,4.0
"Marineland PA0508V Bubble Wand with Anti-siphon Valve, 8-Inch",1,5.0
"Marineland PA0440 Eclipse Replacement Lamp, fits PFE3, 24-Inch, 18 watt",1,2.0
Filter-Aid For Marine/Freshwater Aquariums,1,5.0
"Fine Choke Chain Collar Size: 20""",1,4.0
Fine/Coarse BUTTERCOMB by Chris Christensen,1,5.0
Fine/Medium Greyhound - Teflon,1,5.0
"Marineland PA0115 HOT Magnum Rite-Size Foam Sleeve, 1-Pack",1,5.0
Fire Hose Double Tennis Ball Toy - Medium Stretch N Fetch,1,2.0
Fencemaster 10X10x6 Econ Kennel 510106 Pet Carrier/Crate/Kennel,1,4.0
Marineland Visi-Therm Submersible Heater 200W,1,5.0
Marineland Visi-Therm Submersible Heater 250W,1,1.0
Marineland filtration PR2002 Bio-Wheel Pro Assembly for Eclipse 3 and Magnum 350 Pro,1,5.0
"Feathered Phonics The Seed Guard, Small",1,5.0
Marshall Folding Small-Animal Mini Mansion,1,4.0
Feathered Phonics Volume 8: Teach Your Bird Espanol,1,1.0
"Marshall Ferret Super Cube, Pattern Fleece",1,3.0
"Marshall Ferret Sport Balls Asst, 2-Pack",1,5.0
Featherstone Heights Cape Cod Bird Cage 290,1,4.0
Featherstone Heights Stone Cottage Bird Cage 292,1,5.0
Marshall Ferret Playpen 8 Panel,1,5.0
Feeding Tube #3.5,1,5.0
Marshall Ferret Leisure Lodge Frog,1,5.0
Feline Furniture Cat Castle,1,2.0
Feline Greenies - Salmon Flavor 3oz,1,5.0
Feline Greenies 3 oz. Package Liver,1,5.0
"Feline Mouth Gag 3""",1,4.0
Feline Townhouse Cat Condo,1,5.0
Feliway Comfort Zone Refill,1,5.0
Marshall 8-Ounce Ferret Creme Rinse,1,5.0
Marshall 2-4/5-Ounce Ferret-Aide Electrolyte/Hydration Concentrate,1,1.0
Feliway Comfort Zone for Cats Feline Behavior Modification Plug-In,1,5.0
Felo-Form (Vet-a-Mix) - 50 count,1,5.0
Felovite II with Taurine (2.5 oz) by EVSCO,1,5.0
"Mars Petcare Us Inc 01557 ""Whiskas"" Savory Cuts Poultry Variety Pack 3 Oz. - (Pack of 4)",1,5.0
Mars Fishcare Europe Pondcare Aquatic Plant Food,1,5.0
Mars 01783 Small Breathbuster 17.6 Oz,1,5.0
"Maroxy Anti-Fungal Solution For Aquariums, 2 oz",1,5.0
"Macknyfe Stripping Knife, Medium - Orange",1,5.0
"Macknyfe Muckraker, Fine - Red",1,5.0
MY FIRST HOME GUINEA PIG KIT LM,1,4.0
Football Fever Dog Costume - XLARGE,1,4.0
Littermaid Self-Cleaning Litter Box,1,1.0
LitterMaid Waste Container,1,2.0
"Fluval Rubber Seal Ring for Canister Filter Case, 185-Millimeter",1,5.0
"Fluval Suction Cup for Filters, 30-Millimeter, 4-Pack",1,5.0
Fly Terminator Refill - 4 oz,1,2.0
Flying Saucer Dish 15 inch,1,5.0
"Flying Squirrel, Small (Blue and Orange, 12 in.)",1,4.0
Foal-Lac Pellets,1,5.0
Food Sticks - 2.2 lb.,1,5.0
Litter Scoop (pan not included),1,3.0
Fooey Ultra Bitter Spray - 4 oz,1,1.0
Litter Pan Jumbo,1,5.0
Lipo-form (500 Tablets),1,5.0
"Lighted Collar, SM, (12""-16"")",1,1.0
Lipiderm Liquid for Pets 32oz,1,5.0
Lipiderm Liquid 32oz,1,5.0
For Animals-FidoNutrients - 32 oz - Liquid,1,5.0
Forgotten Ruins Aquarium Ornament,1,2.0
Lipiderm Canine Liquid - 8 oz,1,5.0
Formalin-MS 32 oz.,1,5.0
Lion Charm Sterling Silver Jewelry Gift Boxed,1,5.0
Lint Roller Refill by 3M,1,5.0
