product_title,cantidad_reseñas,promedio_score
Jolly Pet 5-Inch Vanilla Scented Jolly Critter Raccoon,8,4.0
Real Meat Lamb Jerky Dog Treats,8,5.0
Urine Off Cat & Kitten Stain & Odor Remover 500mL,8,3.88
KORALIA 2 UL 600 gph 9W,8,4.62
PetSafe 6-Volt Alkaline Battery,8,4.25
Advantage Flea Treatment for Cats 10+ lbs.,8,4.88
Small FlightSuit (Bird Diaper) w/Lanyard plus Flightliners,8,3.75
"Ethical Plush Football Dog Toy, 4-1/2-Inch",8,2.88
Feline Greenies Variety Pack Cat Treats 3 Pack,8,4.38
DISCONTINUED BY MFR 10-4-11 Heska F.A. Granules (1 lb),8,5.0
Kaytee Fiesta Max Food for Cockatiel,8,4.25
Kaytee exact Original Nutrition Food for Cockatiels -- 3 lbs,8,4.38
Synergy Fooey Ultra Bitter Spray 4 Ounce,8,2.88
"The Yuppy Puppy Treat Machine Dog ""Gumball"" Machine",8,4.62
Pet Naturals of Vermont Hip and Joint Extra Strength for Dogs Chicken Liver -- 120 Chewables,8,4.62
Zoo Med Wire Cage Clamp Lamp,8,3.5
Baby biOrb 5 Watt Halogen Bulb,8,1.25
"Multipet's Original Loofa Jumbo Dog Toy in Assorted Colors, 24-Inch",8,4.0
"Blue Buffalo Dry Food for Senior Dogs, Chicken and Rice Recipe, 15-Pound Bag",8,4.25
"Zoo Med Reptile Turtle Eye Drops, 2.25 oz",8,4.5
Rubber Curry Brush for Cats,8,4.5
Pet Pectillin Diarrhea Medication for Pets,8,3.88
"PetSafe Deluxe Pet Panel Panels for Sliding Glass Doors, 93-96 Tall",8,3.25
Keep Off! Repellent 16-Ounce Spray,8,3.5
"Kaytee Wood Pellets Litter, 25-Pound Bag",8,4.25
"Joint MAX Triple Strength for Dogs, 120 Chewable Tablets",8,4.62
Zodiac Carpet and Upholstery Aerosol Spray,8,3.25
Merrick Cowboy Cookout Dog Food 30lb Bag,8,3.88
Merrick Cowboy Cookout Dog Food 13.2 oz (12 Count Case),8,4.12
"Hagen AquaClear 110 Nylon Bag, 2-Pack",8,3.75
Mrs. Meyers Oatmeal Pet Shampoo,8,4.88
Pork Chomps Roasted Pork Twistz for Dogs,8,4.12
Ethical Fleece Rabbit 9-Inch Dog Toy,8,4.5
DVM Derm Caps Liquid - Economy 6 oz,8,4.12
Simple Solution Potty Training Aid 16oz,8,2.25
Pet SuperJuice for Dogs,8,4.5
Coleman Pet Bone Lounger,8,4.75
"Ideal Pet Doors Super Large Ruff Weather Wall Kit, 15-Inch by 23-1/4-Inch",8,3.12
"Marineland MN606UL Mini-Jet Adjustable Flow Pump 606, 82-153 GPH",8,4.62
General Cage-Soft-Sided Dog Crate - Green,8,4.75
Allercaine Anti-Itch & Hot Spot Spray - 12 ounce,8,3.38
Playfence Retractable Gate System,8,2.62
K9 Super Fuel (4.27 lbs.),8,4.0
"Multipet Curly Pets Dog Toy, Pig",8,3.5
Arctic Paws Original 4-Ounce Yummy Chummies Original Treats,8,4.88
Wizdog Indoor Dog Potty,8,3.75
"Ever Clean Plus Multi Crystal Unscented Cat Litter, 25 Lb Box",8,3.25
"Richell Wood Pet Food Pedestal, Small, Autumn Matte Finish",8,4.5
"Just Born Nursing Bottles for Puppies and Kittens, 2-Ounce",8,4.5
ASP CLLR HVY TRNG 20INX3.2MM,8,3.62
60 cc Disposable Syringe without Needle,8,3.62
Midwest Metal 11 Pet Barrier 6 Bar Tubular,8,3.12
Bamboo Combat Flying Calf Dog Toy,8,4.0
8in1 eCotrition Snak Shak Activity Log- Hamster/Gerbil,8,4.25
Lafeber's Premium Daily Diet Pellets for Macaw/Cockatoo 5lb Bucket,8,3.75
Soft Finger Toothbrush,8,3.88
"Chuckit! Tennis Balls, Medium, 4 Balls",8,2.38
Tabimin Tropical Tablets,8,4.62
Tuffy's Junior Bowmerang Dog Toy,8,4.12
Canada Goose Migrator Bird Plush Dog Toy,8,3.38
"Dog Mate Disc-O-Dog Flying Disc 9"" Yellow",8,4.38
"Coralife 05508 Mini Flourescent Colormax Lamp, 10-Watt",8,4.0
Plaque & Tartar Control Water Additive - 16 oz,8,3.88
"All Glass Aquarium AAG21224 Fluorescent Deluxe Hood, 24-Inch",8,3.5
NaturVet Calm Down! - For Cats 8 fl oz.,8,2.75
WizDog Indoor Dog Potty,8,3.88
Frontline Dog Flea Relief Spray 500ml Bottle,8,4.0
Coralife 76000 Pure-Flo II 24-Gallon Per Day 3 Stage System,8,3.75
Petmate Deluxe Fresh Flow Medium Black Pet Fountain,8,3.62
"Lambert Kay Fresh'n Clean Dog Creme Rinse, 1-Gallon",8,5.0
Peter's Peter's Pine Cones,8,4.5
12 cc Disposable Syringe with Tapered Curved Tip,8,4.5
Natural Oatmeal Shampoo - Gallon,8,3.88
JLA Original Pet Pocket Carrier,8,3.75
"Simple Solution Grooming Glove for Pets, 1 Pair",8,3.0
Cadet 25-Pack Pig Ears Dog Chews,8,5.0
"Simple Solution Litter Box Cleaner and Deodorizer, 16 Ounce Spray",8,3.38
Doggie Dooley 3535 35th-Anniversary Leach-Bed-Style Pet-Waste Disposal System,8,2.75
"Doggie Dooley 3116 Waste Terminator, 1-Year Supply",8,3.0
"API Stress Coat Water Conditioner, 64-Ounce",8,4.5
"Leather Lead - 5/8"" x 6'",8,3.88
"Trophy Animal Dyne, Gallon",8,5.0
Laxatone Tuna Flavor (2.5 oz),8,4.0
Marin For Large Dogs 30ct Chewable Tablets,8,4.38
Blue Ribbon Complete Bird Cage Kit for Small Birds,8,4.62
"Oster Universal Comb Attachment Blade Guard 7-Piece Set, Size # 0, 1, 2, 4, 6, 8, 10 for Oster Professional Animal Clippers",8,3.25
Oster Hi-Velocity Adjustable Table and Cage Dryer,8,4.12
"Blue Buffalo Weight Control Formula Dry Dog Food, 15-Pound Bag",8,4.62
"Oster Home Pet Grooming Kit, 15-Piece",8,1.88
Sweet Potato Dog Chewz - 3 Pack- Value Pack Big Boyz,8,4.5
"Wee Wee and Housebreaking Training Pads, 23*36 Size, 300 Per Case PACKAGED 6 BAGS OF 50",8,3.0
Large Plexidor Pet Door / Dog Door for Doors (Silver),8,4.62
"Molor Deluxe Cat Fountain, Blue",8,3.75
Large Aquarium Betta Keeper,8,2.12
Aquarium Pharmaceuticals PondCare AlgaeFix,8,4.5
"Petrodex Dog Dental Chews Medium Dog, 5-Ounce",8,4.5
Super Pet Bunny Flip 'n' Toss Toy,8,4.88
Zoo Med Little Dripper,8,3.5
PETCO Bird Cage Seed Guard,8,2.5
Soggy Paws Towel Small,8,4.75
"LG Kuranda Bed, Cordura (40x25)",8,4.88
Eradimite 1 oz,8,3.75
"Bio Spot Spot On for Dogs 31-60 lbs., 3 Months Supply",8,3.25
Multipet Look Who's Talking Pig Dog Toy,8,3.25
"Embroidered Berber 8"" Bone Dog Toy in Blue",8,3.62
Butler NutriSentials Lean Treats for Large Breed Dogs,8,4.0
"Veterinarian's Best Pet Swabs Tear Stain Guard, 24 Count",8,3.62
NaturVet GrassSaver Liquid,8,4.0
"Top Performance Pet ProDental Dental Gel, 4-Ounce",8,3.62
Gamma Vittles Vault Airtight SoftStore Pet Food Storage Container,8,4.5
Suction Cups for Airline Tubing - 4 pk,8,4.88
Rio Plus 2100 Aqua Pump 692 GPH,8,4.38
"Dingo Mega Mini Bone 7-Pack, 5-Ounce",8,4.62
Sweet Potato Dog Chewz - 3 Pack - Regular Bichon Fries,8,4.5
"WildSide Salmon - Wild Alaskan Freeze Dried Salmon Treats for Dogs, 3 oz. (3 Pack)",8,4.5
Multipet Look Who's Talking Parrot Dog Toy,8,3.75
"Ark Naturals Ears All Right, Gentle Ear Cleaning Lotion for All Pets - 4 fl oz",8,4.38
"ArthriMaxx Liquid Joint Supplement for Dogs, Glucosamine Chondroitin and MSM, 32 oz",8,4.5
"Yeowww! Catnip Toy, Yellow Fish",8,4.38
Kyjen Harley the Hedgehog Junior Plush Dog Toy,8,4.0
Ithaka 7 Pet Carrier,8,3.62
Ergo Outdoor Pet/Pond Feeder,8,3.25
Ergo Smart Chime,8,2.0
Ergonomic Slicker Pet Brushes,8,3.25
Multipet Plush Hanging Tree House for Birds 6-Inch,8,4.88
Blue Ribbon Filter Floss 7 oz,8,4.88
"Multi Pet Nuts For Knots Large Cotton Rope Ball Dog Toy 5""",8,3.0
Groomer's Edge Power Clipper 401,8,3.5
"Marineland DJ100 Duetto Internal Multi-Filter for up to 20-Gallon, up to 92 GPH",8,4.62
Wardley Essentials Tropical Premium Flakes 6.8 Ounce,8,4.88
Engraved Pet ID Tag Order Form - Mail In For Engraving - No Additional Cost,8,3.38
"Dog Drying Towel - 27 1/2"" x 44""",8,4.88
Whiskas Classic Temptations - Savory Salmon - 3 oz,8,4.5
"Super Pet Ferret Super Sleeper, Cuddle-E-Cup with Hang-Tag, Colors Vary",8,4.0
Panacur C Canine Dewormer 3x2gm packet,8,4.25
Panic Mouse Kitty Go Krazy,8,3.62
Panic Mouse Replacement Wand/Feather,8,4.38
"Petmate Large Dog Tree Trolley, 10-Feet",8,3.75
Spot Mediterranean Stainless Steel Double Diner Dog Dish,8,4.88
3 Knot Rope Tug Dog Toy in White,8,3.5
Rio 10HF HyperFlow Water Pump - 660 GPH,8,5.0
Sticky Paws Furniture Strips- 24 Strips,8,3.12
HBH Hermit Crab Variety Bites,8,5.0
"Bio-Floss Filter Media for Cascade Canister Filter Pumps, 6-pack",8,4.75
Ivomec Injection 1% 50ml Btl,8,5.0
Innotek Extra Ultrasmart Collar Charging Station,8,4.25
"Petmate Le Bistro 10-Pound Feeding and 2.75-Gallon Watering System with Microban, Bleached Linen",8,4.25
LARGE - Dogzilla Dog Costume,8,3.38
Doc Ackermans Epilepsy & Seizure Formula,8,4.0
Hagen Exo Terra Reptile Cricket Feeder,8,2.75
EZ Fill Glass Hummingbird Feeder,7,3.29
Multipet's Look Who's Talking Plush Chick 5-Inch Dog Toy,7,4.57
Supreme Charlie Chinchilla Carrot & Fruit Food,7,3.86
Blue Ribbon Plant Sinkers Blister 12pk,7,2.57
Warren Eckstein Hugs & Kisses Dog,7,5.0
"8in1 Ferret Peanut Butter Crunch Treats, 5-Ounce",7,3.57
"8in1 Perfect Coat Deoderizing Bath Wipes for Dogs, 100-Count",7,3.43
8 in 1 Ultra-Blend Select Complete Nutrition Ferret Diet,7,4.0
Wellness Super5mix Complete Health Whitefish & Sweet Potato Recipe Dry Dog Food 30-lb bag,7,4.86
"Exotic Environments Cobblestone Castle Walls Aquarium Ornament, 10-Inch by 3-1/2-Inch by 5-1/2-Inch",7,4.86
"Ware Nylon Walk-N-Vest Small Pet Harness and Leash, Large ""Color May Vary""",7,4.71
Vo-Toys Pet Voyage Bird Traveler Tropical Print 12 1/4 in x 16 in x 8.5 in,7,4.0
"8in1 Parakeet Canister, 8-Ounce",7,3.71
"Merrick's Miss Porky Chew ( 6-8"")",7,4.29
"Felidae Dry Cat Food for Senior and Overweight Cats, Platinum Formula, 15 Pound Bag",7,3.43
Sweet Potato Dog Chewz - 6 Pack - Regular Bichon Fries,7,5.0
Marshall Ferret Ark,7,4.57
Multipet Wiggly Giggly Jack,7,2.71
"Marshall Polar Ferret Toys Asst, 2-Pack",7,5.0
"Ware Metal Small Pet Tread Wheel, Large",7,3.14
Marshall Ferret Drying Sack,7,3.14
Merrick Surf & Turf Cat Food 5.5 oz (24 Count Case),7,3.43
Small Animal Water Bottle,7,1.86
"Midwest Quiet Time Deluxe Plush Pet Bed, Camel, 40""x27""",7,4.71
"MaxiGuard OraZn Pet Oral Care, 2 oz.",7,4.57
"8 in 1 Excel Vitamin Soft Moist Treat for Senior Cats, 3 Ounce Pouch",7,3.43
"Midwest Quiet Time Deluxe Plush Pet Bed, Black, 23""x18""",7,4.71
Fat Cat Kitty Hoots Big Mama's Double Wide Scratchy Box with Catnip Toy,7,5.0
"Midwest Quiet Time Deluxe Plush Pet Bed, Black, 40""x27""",7,4.71
"Midwest Quiet Time Deluxe Plush Pet Bed, Black, 46""x29""",7,4.71
"Midwest Quiet Time Deluxe Plush Pet Bed, Camel, 23""x18""",7,4.71
"Midwest Quiet Time Deluxe Plush Pet Bed, Camel, 35""x23""",7,4.71
"Midwest Quiet Time Deluxe Plush Pet Bed, Camel, 46""x29""",7,4.71
"Synergy Veterinary Formula Snow White Shampoo, 17 Ounce",7,4.57
"Boca Rat (Varies, 3')",7,5.0
Firstrax Poop Patrol Small Rake,7,4.71
"Synergy Tear & Fur Stain Remover, 2 Ounce",7,3.0
Super Pet Small Animal Pro-Slicker Brush,7,2.71
Midwest Quiet Time Pet Bed Deluxe Gray Ombre Swirl 46 Inches by 29 Inches,7,4.71
SmartCat Fishing Frenzy Cat Toy,7,3.71
Firstrax Pet Suites Double Door Multi-Use Pet Kennel,7,4.43
"F.M. Brown's Encore Parakeet Food, 5-Pound",7,4.57
Nature's Miracle Pet Mess Easy Clean-Up 12oz,7,4.86
Flea and Tick Shampoo,7,4.57
Eqyss Micro Tek Pet Shampoo - 16 Oz,7,5.0
"8in1 Ear Mite Remedy, 4-Ounce",7,2.86
Nature Zone Cricket Breeding Kit,7,2.57
Fat Cat Kitty Hoots Crackler Original Butterfly,7,4.57
"Blue Ribbon Square Style Roof Bird Cage, 18-Inch by 18-Inch by 22-Inch, White/Blue",7,3.71
Autopetfeeder,7,2.57
Birdscapes Sunflower Garden Lantern Bird Feeder,7,3.71
847C PET NAIL FILE 12,7,3.29
"Natural Chemistry De Flea Concentrate Flea and Tick Shampoo, 1-Gallon",7,4.43
"Elite Filter Cartridge for Mini Underwater Filter, 2-Pack",7,4.71
"Exo Terra Heatwave Rock, Ul Listed",7,4.43
Nature's Miracle - Quick Results Training Pads - 50 Count,7,4.29
"F.M. Brown's Tropical Carnival Mouse and Rat Food, 2-Pound",7,2.71
Fish Food Small Pellets Semi Floating 36% Protein Ten Pounds,7,4.86
"Blue Ribbon Arch Style Roof Bird Cage, 14-Inch by 16-Inch by 19-1/2-Inch, White/Blue",7,3.29
"Natural Balance Lamb and Rice Formula Dog Food Rolls, 1-Pound",7,4.43
Natural Balance Lamb Roll-A-Rounds Dog Treats (8-Ounces),7,4.57
"Farm Innovators Submergible Cast Aluminum ""Around The Farm"" Utility De-Icer Model C-500, 500-Watt",7,4.57
Arthramine Healthy Joints & Bones (Sm/Med Breed) Chewable Tablets 120 ct,7,4.71
"Nature's Instinct Rythemwise Rain Stick for Amazons, Macaws, and Similar Birds",7,3.86
"Max & Lucy - Plush Taffy Pal with Sound Chip, Large",7,3.29
Merrick Grammys Pot Pie Dog Food 15lb Bag,7,5.0
"Feline Soft Claws Cat Nail Caps Take-Home Kit, Large, Pink",7,5.0
Mirra-Coat 03 Dog,7,4.71
Blood Buster Blood & Stain Remover 4 Oz,7,3.43
NUPRO (20 lbs) for Dogs,7,4.86
Maximum ChlorhexiDerm Shampoo 4% Gallon,7,4.86
"Wellness Canned Dog Food for Senior Dogs, Senior Recipe",7,4.71
Sweet Potato Dog Chewz - 3 Pack - Regular Veggie Rawhide,7,4.71
Mrs. Meyer's Oxygen Bleach Stain Remover,7,4.29
NEW! Puppy Builders Pull n Play Puppy Gym Puppy Toy,7,5.0
Marineland Perfecto Glass Canopy 48 in. x 18 in.,7,3.71
Bladder Strength for Dogs - 90 tablets,7,3.86
Evsco Select Full Spectrum Antioxidant 60 Ct,7,4.14
Newman's Own Organics Adult Variety Pack Canned Cat Food,7,3.71
Whiskas Temptations Seafood Medley Flavor Treats (3-oz pouch),7,4.86
"Newman's Own Organics Dog Food Adult Chicken & Brown Rice Formula Dry, 25-pounds (Pack of1)",7,5.0
Ethical Karate Dog Multi-Sound Plush 8-Inch Dog Toy,7,4.71
"Ethical Mini Teaser Cat Toy Wands, Assorted",7,3.43
Sergeant's Sniffers Lifestages Treat,7,4.29
Muttluks - All-Weather Size XX-Small,7,3.29
"8in1 Safe-Guard Canine DeWormer for Small Dogs, 1-Gram",7,4.71
White's Nail Trimmer,7,4.0
"Smells and Stains Enzyme Pet Stain and Odor Eliminator, 33.8 -Ounce",7,4.14
"Fashion Pet Classic Cable Dog Sweater, Cobalt Blue, X-Large",7,4.0
Nemex-2 Wormer 2oz,7,4.57
Bitter Apple Cat Chew Deterrent - 4 oz,7,3.14
ABO Gear Pet Down Pet Bed,7,4.0
Nekton Labs BNK2530500 Lori And Parakeet Diet,7,4.57
Eye Clear 4 Ounce,7,4.43
"Miller Manufacturing 9810 Round Jar Galvanized Feeder Base for Birds, 1-Quart",7,3.43
Easy Walk Harness - Black Small,7,3.86
Exo Terra Worm Dish Mealworm Feeder,7,4.0
Walk-about Combo Spiral Stake with 15 cable,7,4.0
Volkman Avian Science Diet Parrotlet Bird Food 4 Lb,7,4.71
"Flexi Comfort Long 26-Feet Small Leash, 26-Pound, Blue/Black",7,4.43
"Marineland PA11486 Canister Filter Bio-Balls PC 160-360, 90-BioBalls",7,4.14
Wholistic Canine Complete Joint Mobility 2 lbs,7,4.43
Easy Rider Car Harness - Medium,7,4.57
Easy Rider Car Harness - Large,7,4.86
"Blue Ribbon Square Style Roof Bird Cage, 14-Inch by 18-Inch by 20-Inch, White Granite",7,3.71
Nathan's Hot Dog Treats - Beef Flavored-Beef,7,4.86
"48H"" x 24"" 8 Panel GoGo Black Epoxy Exercise Pen w/ Walk Thru Door",7,4.0
Ethical A-Door-Able Bird Cat Toy with Rattle and Catnip,7,4.57
Ethical 3-Inch Stoneware Small Animal Dish,7,4.86
Bio Coat Concentrated Biotin Supplement - 6 oz,7,5.0
"42"" Single Door Foldable Dog Crate Kennel Cage, 42""L x 25""W x 28""H",7,3.57
Bergan Blitz Soft-Sided Pet Carrier,7,5.0
SportDOG Bark Control - 18 levels,7,3.71
Zoo Med Carbon Bag for 501 Turtle Filter,7,2.29
PetSafe ScatMat Dog Training Strip Extension,7,3.0
"PetSafe Quick-Fit Pet Door, White",7,4.29
Two Way Dog Coupler,7,3.86
"Zoo Med AquaSun T5-HO Double Light Linear Fluorescent Hood, 36-Inch",7,3.43
Airline Holders for Aquariums - 6 Pack,7,2.14
"PetSafe Infrared Pet Door with Barrier, Large",7,1.43
Grizzly NuTreats for Dogs 6oz,7,4.71
CHOCOLATE BROWN - ADJUSTABLE CAT SAFETY COLLAR-BREAKAWAY,7,4.0
Ultimate Touch Slicker Brush,7,4.57
Cosmic Pet Shuttle Cardboard Carrier,7,2.86
Cosmic Rainbow Balls,7,2.43
"KONG Puppy Goodie Bone Dog Toy, Small",7,3.71
"Air Kong Football, Large 7"" (Kong)",7,3.57
"Greenies Treats for Dogs Monster Treat-Pak 107 Teenie, 30 Ounce",7,5.0
Bach Rescue Remedy - 20 ml bottle,7,3.57
Royal Canin Chihuahua (28) Dry Dog Food,7,4.71
"Super Pet Hamster Chewbular Play Tube, Medium, Colors Vary",7,4.29
"United Pet Group Kookamunga Chicken Treat for Pets, 5-Ounce",7,3.0
"PetSafe Cat Flap, Small, White",7,3.14
Grooming Bands for Dog Bows,7,2.86
Tuffy's Ultimate Fish Dog Toy,7,4.29
Habitrail Mini Maze,7,3.43
Coralife Energy Savers ACLAF877 Deep Six Hydrometer,7,2.43
Habitrail Mini Exercise Ball with Stand,7,3.29
"All Glass Aquarium AAG29603 Versa Top, 36bf",7,4.71
Aran 1 Double-Door Pet Carrier,7,3.71
Petmate Giant Doggie Litter Pan,7,4.71
Connectin Chewable - 150 tabs,7,4.71
Petmate Foodmate Food Bin 50 lbs,7,3.0
"K9 Advantix Flea Control For Dogs, 11-20 lbs Teal, 6 Month",7,4.43
K9 Advantix II 12 Pk Red Dog 21-55 lbs,7,4.86
"All Glass Aquarium AAG25930 Fluorescent Strip Light, 30-Inch",7,4.0
Gumabone Chicken Bone Dog Chew Toy,7,3.86
Arctic Paws Salmon Crunchies 4-Ounce Yummy Chummies Crunchy Treats,7,4.86
Petmate 27-by-36-Inch Heated Pillow Bed,7,3.43
Petmate 22980 Flex Pet Litter Mat (Assorted Colors),7,4.14
Bamboo Cat Guilotine Nail Trimmer with Styptic and File (Colors Vary),7,2.0
"Zoo Med Deluxe Porcelain Clamp Lamp with 5.5-Inch Dome, Black",7,4.29
Coralife 77071 6X Turbo Twist UV Sterilizer,7,4.14
"All Glass Aquarium AAG20007 Inc Economy Hood, 16-Inch",7,3.14
PetVision Eye Drops,7,3.43
"PetSport Tuff Mint Balls, 2 Pack",7,4.0
Rio 14HF HyperFlow Water Pump - 840 GPH,7,3.71
SportDOG Wire and Flag Accessory Kit,7,3.71
CritterTrail Snap-on Comfort Wheel,7,4.29
Kala Health ARTHRIX Plus for Dogs (90 Chews),7,4.71
Urine Off Dog & Puppy Stain & Odor Remover Gallon,7,4.57
Zilla Black Clamp Lamp,7,4.57
"Pet Gear Sportsman Pet Bed for Dogs up to 70-pounds, Green Camouflage",7,4.0
"Zanies Poly-Filled Latex Long Silver Squawk Dog Toy, 15-3/4-Inch",7,3.29
"Pet Gear Home 'N Go Deluxe Soft-Sided Pet Crate, Small, Red Poppy",7,4.71
"Pet Gear Home 'N Go Deluxe Soft-Sided Pet Crate, Large, Burgundy",7,4.0
"Deluxe Silicone 3/16"" Flexible Airline Tubing for Aquariums",7,4.57
SAM Down Under Jackeroo Home,7,3.71
Pet Flowbee,7,3.14
Adams Plus Flea & Tick Mist 32oz,7,3.0
Zack & Zoey 2-Way Coupler - Jet Black,7,4.86
"Kordon/Oasis (Novalek) AKD37656 Rid Ich for Aquarium, 16-Ounce",7,4.57
Solid Gold Gourmet Blended Tuna Canned Cat Food,7,4.43
Dermasol Skin Care Spray,7,4.0
Yesterday's News Soft Unscented Litter 26.4 lb,7,4.0
"Veterinarian's Best Healthy Coat Shed & Itch Relief Chewable Tablets, 50 Count",7,3.0
"Kyjen Fire Hose Flyer Dog Toy, Red",7,3.86
"Diarsanyl Oral Paste for Large Dogs 67-132 lbs, Foals and Calves, 60 ml Syringe",7,4.86
Merrick Turkey Steak Patties for Dogs,7,2.0
Perfecto Glass Canopy 30 Inch,7,4.86
Perfecto Glass Canopy 24 Inch,7,3.71
Dingo 2-Pack 4.4-Ounce Wag'n Wraps,7,3.43
"Safari Flea Comb for Dogs, Wood Handle",7,3.29
Glucosamine DS Tablets 120 ct,7,4.0
Glyco Flex I - New Formula - 120 tabs,7,5.0
20' Large Dog Tie Out Cable Leash,7,4.43
Gold Trimmed Tiny Grooming Bows with Elastic Hairband - The Perfect Touch - Bag of 25,7,2.14
"Royal Canin Dry Dog Food, Giant Breed Adult 28 Formula, 35-Pound Bag",7,4.14
Goodwinol 1lb,7,4.43
Good Pet Stuff Pavlov's Cat Scratch Feeder Interactive Treat and Food Dispenser,7,2.86
"Kaytee Exact Rainbow Food Chunky for Parrots, 20-Pound Bag, Large",7,4.57
Pet food - Ultra prem dry dog food 17lb,7,4.43
"Pet Voyage Viewer Car Seat, 13"" x 10"" x 7.5"", Gray with Black Trim",7,5.0
Venus Laboratories DVE912524 Stain and Odor Remover Quart,7,3.43
Vermont Dog Fleece Bone Dog Toy,7,3.29
"Royal Canin Dry Dog Food, Maxi Large Breed Adult Formula, 35-Pound Bag",7,4.86
Gold Medal Tear Stain Remover,7,2.0
Solid Gold Tiny Tots Treats (10 Oz.),7,4.43
Kaytee Spray Millet for Birds,7,2.43
Pet Stages Catnip Two Toss,7,4.71
Gold Medal Clean Ears,7,3.86
"Aria Satin Acetate Ribbon Multicolor Dog Bows Canister, 3/8-Inch, 100-Pack",7,3.86
Kennel Odor Eliminator - 8 oz,7,4.86
Super Pet Long John Litter Pan(Colors may vary),7,3.43
De Flea Pet Shampoo Size: 32 Ounce,7,3.86
Kitty Babble Ball Cat Toy by Pet Qwerks,7,4.43
Kitty Kitchen Food and Treat Dispenser,7,3.86
"Jungle TB620W Tank Buddies No More Algae Water Clarifier, 8-Tablet",7,3.86
"Jump Restraint Harness for Dogs, Prevents Jumping",7,2.14
Yeowww loween Pumpkins Catnip Toy,7,5.0
Zymox Medicated Rinse - 12 oz,7,4.57
Quiet One Aquarium Pump 3000 - 780 gph,7,3.57
"Hartz Ear Cleaner for Dogs and Cats, 4-ounce",7,2.57
"Super Bird Creations 8 by 3-1/2-Inch Hotsy Totsy Bird Toy, Medium",7,3.71
Home On-The-Go Dog Crate in Black,7,4.14
"Premier Pet Pet KeepSafe 3/4-Inch Medium Break-Away Dog Collar, Black",7,4.29
"Anti-Gas, Chewable Tablets 60 ct",7,3.57
Horseman's Dream Vet Cream 16 ounce,7,5.0
Premier Pet Fido Fleece Dog Coat Flower Power Size 24,7,4.71
Premier Pet Fido Fleece Dog Coat Flower Power Size 22,7,4.71
Premier Pet Fido Fleece Dog Coat Flower Power Size 16,7,4.71
Catalina Aquarium CA 2200 Aquarium Pump 850 GPH,7,3.0
Ra-Cat-A-Sack with Activity Center for Cats,7,2.86
HyLyt Creme Rinse - 8 oz,7,4.86
"Animals' Apawthecary Tranquility Blend for Dogs and Cats, 2oz",7,3.86
The Buddy System - Hands Free Leash - Regular Dog System - Red Large,7,4.29
"Premier Dog Leash Coupler - Black (3/8"")",7,3.57
Premier Busy Buddy Gnawhide Refill Strips (For Funny Bone),7,4.57
Canine Corta-Flx Ultimate - 32 oz,7,5.0
Cell Sorb Plus Small Pet Bedding 28 Qt,7,4.29
"Precision Pet K9 Kooler Portable Fan for Pet Crates, Carriers and Kennels",7,2.57
ILS Lense Dog Goggles XL in Racing Flames,7,4.71
Cat Mate Lockable Cat Flap Door Brown 2-way Lock,7,4.57
Cat Dancer 601 Catnip Cat Dancer Interactive Cat Toy,7,4.29
Zoo Med Repti Basking Lamp 50 Watt for Reptiles,7,3.29
Python Ulti-Vac Pond Aquarium Maintenance System,7,2.29
"Purina Moist & Meaty Burger Cheese, 216-Ounce",7,4.71
"Purina Fancy Feast Gourmet Cat Food Chicken Turkey, 7-Pounds",7,4.57
"Purina One SmartBlend Dog Lamb Rice, 8-Pounds",7,3.86
Carlson 24-Inch Extension for Maxi Pet Gate,7,3.43
"Purina One Smartblend Cat Chicken Rice, 7-Pounds",7,4.86
"Pureness Heavyweight Midget Crock Dish, 4-Ounce",7,4.57
Pureness CP2 Large Cat Pan,7,4.86
"Hikari Bio-Pure Freeze Dried Tubifex Worms for Pets, 0.78-Ounce",7,4.57
Super Pet Critter Canteen - 32 oz,7,2.43
Casual Canine Dog Tuxedo - Dog Costume - Small,7,4.86
Professional Lab #BA110 Pro Bacteria/WTR Kit,7,2.57
"Python No Spill Clean and Fill Aquarium Gravel Tube Extension, 20-Feet",7,5.0
"Hartz UltraGuard Collar For Dogs, Red",7,2.57
"Python No Spill Clean and Fill Aquarium Gravel Tube Hose Extension, 10-Feet",7,4.86
"Casual Canine Polyester Piggy Pooch Dog Costume, Small, 12-Inch",7,3.86
Aquarium Metal Tank Stand Deluxe for 55 gallon Aquarium-TS55,7,2.86
Hartz Tiny Dog Jungle Plush (Colors Vary),7,4.29
Cardinal Laboratories Crazy Pet Crazy Cat Pheromone Magic 32oz,7,4.0
Hill's Science Diet Large Breed Dry Dog Food,7,4.43
"Cat Claws Giant 20"" Litter Scoop",7,3.86
Hartz Mountain 02265 UltraGuard Plus Flea And Tick Carpet Powder,7,2.43
The Gripper Ball 6 Inch,7,3.86
"Char-Tar Old Mother Hubbard Dog Biscuits, small bones (20 oz.)",7,4.57
Praziquantel Tape Worm Tablets,7,4.29
Pounce Crunchy Tartar & Plaque Control Cat Treats,7,4.57
JW Pet Company GripSoft Cat Comb,7,4.57
Rena Air 200 Air Pump,7,3.0
Petstages Multi Texture Chew Ring,7,2.29
Zoo Med Reptile Basking Spot Lamp 50 Watts 2 Bulb Value Pack,7,4.29
Cal Pump PW3500 Direct Drive 3500 GPH Waterfall Pump,7,1.43
"Petsport Bling Bling Blinker, Jade/Pink",7,3.43
Petsport Biscuit Buddy,7,2.57
Rep-Cal Maintenance Formula Box Turtle Food with Fruit,7,4.43
JW Pet Company Insight Inside the Cage Bird Bath Bird Accessory (colors may vary),7,3.86
Rep-Cal Reptile Calcium Powder with D3,7,4.86
"JW Pet Company Insight Sand Perch Swing Bird Toy, Small",7,3.86
Cloud Nine Herbal Healing Salve,7,4.57
Allerpet/D Allergen Neutralizing Solution for Dogs,7,4.29
"JW Pet Company Invincible Chains ST Triple Dog Toy, Small (Colors Vary)",7,2.57
Bamboo Combat Extreme Bone-Tug Dog Toy,7,3.0
Coastal Comfort Adj Muzzles,7,2.71
"Coastal Double Handle Lead Black 6' x 1""",7,4.43
"Petmate Soft Bite Cat Toy, Small, 12-Pack, Fur Mice",7,3.86
"Petmate Portable Pet Home Intermediate, Khaki/Navy",7,3.57
Bamboo CatFisher Rod & Reel Cat Toy,7,2.71
"Petmate Pet Hair Magnet, Pink",7,4.0
Hagen Marina 15-Watt Aqua Glo Showcase Bulb,7,2.14
Super Pet Deluxe Hamster My First Home,7,3.0
"TireBiter Paw Tracks EXTRA STRENGTH - MEDIUM 8""",7,3.29
"Instant Ocean Reef Crystal Sea Salt Marine Mix for Aquarium, 200-Gallon",7,3.57
Pounce Cat Treats Seafood Medley,7,4.14
Pounce Cat Treats Moist Tuna Flavor,7,4.43
Aquarium Systems Maxi Jet 600 Powerhead,7,4.57
"Zoo Med Reptile Shelter 3 in 1 Cave, Small",7,4.14
"Innotek Extra Receiver Collar for Zones Pet-Containment System, ZND-1025",7,3.71
Stuffed Bone - Medium - Beef,7,3.43
Bamboo Dog Slicker Brush with Flea and Fine Tooth Combs (Colors Vary),7,4.71
Innotek Two Zone One Dog Indoor System,7,3.71
Plato Salmon Strips 16oz (Pack of 3),7,4.71
"Zoo Med Reptile Lamp Stand, Economy Size",7,3.0
Petstages Twin Pull Toy,7,4.14
"Plant Assorted Multi-Pack, 4 pike",7,4.43
Planet Pleasures Spiked Pinata Medium 11in Natural Bird Toy,7,4.29
Halti Dog Headcollar Size 3 (Black),7,3.71
"International Veterinary Sciences Quick Bath Wipes for Large Dogs, 10 Count",7,5.0
Halo Purely For Pets VitaGlo Daily Greens,7,2.71
Tidy Cats Litter Box Deodorizer,7,4.29
California Natural Skin and Coat Liquid Supplement,7,4.86
Pill Pockets for Kittens CHICKEN 1.6 oz (45 pockets),7,4.43
Hagen Marina Flexible Coil Brush,7,3.71
"Pennplax Cockatiel Bath, Large",7,3.86
"PetEdge Miracool Dog Mat, Large, 36-Inch, Cowboy Blue",7,2.86
Merrick Turducken Dog Food 30lb Bag,7,4.0
"SynoviG3, 240 Soft Chews 2 Pack",7,3.57
"API Stress Zyme, 64-Ounce",7,4.86
Lixit 32 oz Glass Replacement Water Bottle,7,4.86
Fresh N Clean Scented Creme Rinse - 16 oz,7,5.0
"Lixit 30-0685-036 Dog Water Bottle, Large, 32-Ounce",7,3.29
API Replacement Test Tubes with Caps,7,4.57
Seachem PhosGuard 500ml,7,3.86
"Fluval 404 Magnetic Impeller - 110V, 2nd Generation",7,3.86
Vittles Vault 10 Lbs Q,7,4.57
Lee's Pet Products ALE14103 Airline Control Kit for Aquarium Pumps,7,3.71
"Doggles Large K9 Optix Sunglasses for Dogs, Silver Frame, Smoke Lens",7,4.29
Doggles Originalz Medium Frame Goggles for Dogs with Smoke Lens,7,4.29
"Living World Premium Parakeet/Budgie Mix, 2 Pounds",7,4.71
"Lee's Protein Skimmer Counter Current, Medium",7,3.71
Seachem MultiTest Phosphate Test Kit,7,4.14
Omega Paw SBW Scratch Box Wide,7,2.86
"Dried Fish for Cats, 100-Gram",7,2.57
Doggy Hoots Dog Toy Rings Original Hurl-A-Squirrel,7,4.43
3-in-1 DELUXE PET STROLLER/CARRIER/CAR SEAT FOR DOG/CAT Red color,7,3.0
Bristle Brush for Cats - Small (Hagen),7,4.14
"Vetri-Science Laboratories Nu-Cat Senior Supplement for Pets, 240 Count",7,4.29
