product_title,cantidad_reseñas,promedio_score
The Equalizer Carpet Stain and Odor Eliminator 14 oz,2,5.0
Esbilac Milk Replacer For Puppies 8oz,2,5.0
Esbilac Powder Milk Replacer for Puppies & Dogs 28oz,2,5.0
Opticlear Eye Wash 4 oz.,2,4.0
NATURAL - SMALL - Pure Wool Sweater - FASHIONABLE DOG SWEATER,2,4.5
BAD CUZ DOG TOY - 209019,2,5.0
NaturVet ArthriSoothe Hip & Joint Formula (16oz),2,3.0
"NaturVet Bitter Yuck! No Chew Spray, 8 Ounce (Cat Only Label)",2,3.0
Automatic Pet Feeder - LARGE (Dogs and Pigs over 40 lbs.),2,3.0
Ethical 2-Quart Stainless Steel Flat Sided Fence Pail,2,3.5
Old West Moo Moo Q's 10oz,2,5.0
BEGGIN STR CHZ VALUE 8/10OZ,2,3.5
Avian Maintenance Fruit Blends - Large Parrot - 3.5 Lbs,2,5.0
Doggles ILS XL Chrome Frame and Smoke Lens,2,3.0
Super Pet Simple Sleeper Cozy Hammock,2,2.5
The Original Fetch & Float Toy,2,4.5
NaturVet ArthriSoothe Hip & Joint Formula (500 Tabs),2,4.0
"Omega One Garlic Marine Flakes, 2.2 oz.",2,5.0
Ethical 32-Ounce No-Tip Stainless Dish,2,3.0
Ethical 5-Inch Neon Sock with Catnip and Bell Cat Toy,2,4.0
The Missing Link for Dogs - 1 Pound,2,5.0
"NaturVet ArthriSoothe-GOLD Liquid, 32 Ounce",2,5.0
Ethical 6442 Stainless Steel Pail With Handle 6 Quart,2,5.0
"Doggy Hoots Floppability Bark Targets The ""Ex""",2,4.5
BLUE - MEDIUM - Sporty Fleece Pullover,2,5.0
"Onyx Gravel, 7 kg / 15.4 lbs",2,2.5
Epi-Soothe Oatmeal Shampoo - 8 oz,2,5.0
Organic Plush Dog Toy - Wally the Bear,2,5.0
Automatic Aerosol Dispenser Automatic Refill Dispenser,2,5.0
Omh Biscuit Asst Mini 20 Lb.,2,5.0
"Super Pet Waffle Block House for Pets, Medium",2,4.5
Dogmatic Comfort Clipper,2,5.0
Doggles ILS Large Pink Frame and Pink Lens,2,4.0
AvoDerm Natural Dog Food - Lamb & Rice - 12x13 oz,2,5.0
"Andis CeramicEdge Carbon-Infused Steel Pet Clipper Blade, Size-7, 1/8-Inch Cut Length",2,5.0
"AvoDerm Natural Original Kookies Dog Treat, 20-Ounce",2,5.0
The GoodLife Recipe Wholesome Biscuits Medium and Large Dog Treats,2,5.0
"Omega Paw Mint Dental Ring, Large",2,5.0
Omni Pet No.38LKS 3/8in Spiked Latigo Leather Collar 12in Black,2,4.0
Organic Algae Magic - 16 oz.,2,4.5
N-Bone Wheat Free Twist Stix Dog Chew Treat,2,4.5
NanaCea ProBee Probiotics Prebiotics 300mg (90 caps),2,4.0
Nano Cube 24 Gallon DLX 2006 aquarium with Free stand,2,4.5
"The Grrrip Two Handled Dog Leash - 3/4"" x 4' Black",2,2.5
Ergo No Bark,2,2.0
NaturVet Glucosamine DS With MSM 60 Tabs For Dogs,2,1.5
Automatic Dog Feeder,2,1.5
The Buddy System - Hands Free Leash - Small Dog System - Lunge Buster,2,5.0
Open Top Small Parrot Cage,2,4.0
Omega Paw Groomer Brush,2,4.0
Animal Stuff 5 Step Mini Bear's Stairs - Beige,2,4.5
Operating Scissors - Blunt / Blunt Point,2,5.0
"NaturVet Ear Wash with Tea Tree Oil, 16 Ounce",2,2.0
Doggles ILS Protective Eyewear for Dogs,2,3.5
"Super Pet Take-Home Pet Carrier/Box, X-Large, Pack of 50",2,1.0
EarDr. by PetAlive for Pet Ear Infections and Mites,2,2.5
Ocean Nutrition Formula Two Marine Pellet,2,5.0
"Aquarium Products Aquari-Sol Freshwater Aquarium Treatment, 16-Ounce",2,5.0
Aquari-Sol Treatment For Fish - 4 Oz,2,5.0
"T-Rex Tasty Twigs Chew Sticks for Small Animals, 2 oz.",2,4.5
Duncraft 188G Metal Selective Feeder with Metal Seed Tray,2,2.0
Nature's Recipe Joint & Hip Dog Treats,2,5.0
Nature's Variety Freeze Dried Beef,2,5.0
Duplex Sandwich Cremes - 8 oz.,2,4.5
Natures Logic Natural Canned Dog Food Case Chicken,2,5.0
Natures Logic Natural Venison Dry Dog Food 26.4lb,2,5.0
"Aquarium Pharmaceuticals 144B Fish Feeder Block, 5 oz.",2,2.0
"Natures Miracle JFC Stain and Odor Remover, Pint",2,5.0
Natures Miracle Just For Ferrets Stain & Odor,2,4.0
Aquarium Pharmaceuticals PondCare Pond-Zyme with Barley,2,2.5
"Durango Bully Boys, 6 Inch, Original, 50-Count Box",2,5.0
Natures Miracle Quick Results Trng Pads 30 Count,2,5.0
Aquarium Products Barley Straw Extract 16-Ounce Pond Cleaner,2,3.0
"Tetra 26158 Whisper Bio-Bag Cartridge, Medium, 1-Pack",2,1.5
Neat Eats Dog Bowls,2,5.0
TALKING BABBLE BALL BIG DOGGIE,2,4.5
Easy Walk Harness - Navy and Royal in X Large,2,3.5
Nutri-Cal for Dogs Senior 4.25 oz.,2,3.0
"Nutramax Cosequin Equine Powder, 700 Gram Container",2,5.0
Nutramax Cosequin Double Strength Capsules,2,3.0
EFA Caps - 60 ct,2,5.0
Nekton Labs Bio-Feather Grow 5.29oz,2,5.0
Nekton Labs S Bird Vitamins 2.65oz,2,4.5
EGG FOOD EXOTIC FINCH 1.1 LB,2,5.0
Artemis Fresh Mix 13oz Can Chicken Dog Food,2,5.0
Easy Walk Harness - Navy and Royal in Large,2,5.0
Nemex 2 - 16 oz,2,5.0
"Easy Turn Stakes 9 mm x 18""",2,5.0
Nature's Recipe Canine Venison Treats,2,5.0
"Nature's Recipe Breed Specific toy Breeds Dry Dog, 5-Pound",2,5.0
"Nutri-Vet Hip & Joint Lamb & Rice Medium Dog Biscuits, 20 Pound Bulk Box",2,4.5
Artemis Fresh Mix Md/Lg Breed Dry Puppy Food 30 lb,2,5.0
"T-Brush, 27 mm",2,5.0
"Tetra Marine Flakes, 2.82-Ounce, 500-Ml",2,2.5
T-Rex Box Turtle Dry Formula,2,4.5
Nutritionally Enhanced Chew Bone - Peanut Butter - Petite - 8 pk,2,5.0
T-Rex Comfort Leash - Medium,2,3.0
"Nature's Instinct Foragewise Zig Zag for Conures, Amazons, Macaws, and Similar Birds",2,3.5
"Eheim Jager Heater 9"" 75 Watt",2,5.0
Dream PJ's LilaC-Small - Part #: 25LSM,2,5.0
Nature's Logic Canned Food - Venison - 12 x 13.2 oz,2,5.0
AquaClear Levelling Device for Power Filters,2,4.5
Nutri-West - Total Joint Support - 120,2,4.5
Artemis Fresh Mix Small Breed Dry Dog Food 30 lb,2,5.0
"Tetra JumboKrill, 1.40-Ounce, 40-Gram",2,3.0
Droll Yankees BHM Bird House Mount,2,3.0
Droll Yankees CJM23HG 23 Inch Heirloom Gold 6 Port Sunflower Feeder,2,5.0
Nature's Logic Natural Venison Dinner Fare Canine Canned Formula,2,5.0
Droll Yankees PSF-S Premium Suet Feeder Single,2,3.5
"Nutri-Vet Pet-Ease Natural Calming Spray for Dogs, 4 Ounce",2,3.5
T-Rex Crab Shack,2,4.5
"Droll Yankees Tubular Thistle Bird Feeder 16""",2,4.5
"Nutri-Vet Pet-Ease Natural Calming Diffuser Refill for Dogs, 1.69 Ounce",2,3.0
Eheim EhfiFix Grob Mechanical Filter Media 5 Liter,2,5.0
Nature's Miracle Just For Cats - 32 oz,2,5.0
Nature's Miracle Odor Control Clumping Cat Litter 18-lb bag,2,3.5
Eheim Aquaball Internal Filter 2210,2,4.0
"Eheim - Jager 9"" 50 Watt submersible heater",2,5.0
Nature's Ocean Marine White Sand Premium Marine Substrate,2,5.0
T-Rex Inc H.Crab Treat Banana 50Gm,2,3.0
Duck And Brown Rice dog Treat Balls - Large,2,5.0
Easy Traveler Envirosprayer,2,4.5
EHEIM Coarse Filter Pad (Blue) for Classic External Filter 2217 (2 Pieces),2,5.0
"System II Pre-Filter Sleeve 12/pk - 16 - 20""",2,4.5
Tapix Cat Tracking Mat,2,3.5
"Aquarium Tank Top Screen Cover, 55 Gal",2,3.0
New York Yankees - Dog Collar Sm,2,5.0
Nordic Hooded Sweater - Extra Small,2,5.0
"Aquarium Tank Top Security Clips, Large",2,3.5
Aquatic Gardens Profile Aquarium Heater,2,1.0
Non Sterile Cotton Roll - 1 lb,2,5.0
Nolvasan Surgical Scrub - Gallon,2,5.0
"Teafco Argo Airline Approved Medium Aero, Pet Carrier, Tango Orange",2,5.0
Aquatic Ultra Sun Bulb,2,3.0
EXPEL Odor Neutralizer (32oz),2,4.0
EZ Crock 20 oz,2,5.0
East Side Collection Estate Smoking Jacket - X-SMALL,2,4.0
Nobbly Wobbly II - Medium,2,5.0
Tagalong Deluxe Pet Bicycle Basket (Pink),2,3.5
No/No Green and Yellow Sunflower Basket Bird Feeder SB00316,2,3.0
"Tetra 19117 Water Wonders Fresh Water Plant Cabomba, 9-Inch",2,3.0
Talk To Me Treat Ball Large,2,5.0
Tapeworm Tablets 30 tabs - Happy Jack,2,2.5
Talk to me Treats - 4 ounce Mint Flavor,2,4.0
"Ark Naturals Joint ""Rescue"" Super Strength Chewable for All Pets, 90 Each",2,5.0
Newman's Own Turkey & Br Rc Dog Food ( 12x12.7 OZ),2,3.5
"Newman's Own&#0174;Organics Dog Treats, Vegetable, 10-Ounce Bags (Pack of 6)",2,5.0
"Tan Comb Dog Untangler 7""",2,5.0
Ear Wash with Tea Tree Oil (All Natural) - 4 oz,2,1.5
Newmans Own Organic Advance Dry Dog Food 12.5lb,2,5.0
"Night Dawg Collar, Small, Red",2,4.5
Nilotron Aerosol Refills - New Morning Scent,2,5.0
Nilodor Deodorizing Pet Shampoo,2,5.0
"Earth Friendly Products Dander-Out Spray, Natural Pet Formula - 22 fl oz",2,3.0
Ark Naturals Chicken Jerky Strips 9 oz,2,5.0
New Life Spectrum Thera A Large Fish 150g,2,3.5
North American Pet Cat Toy On Spring On Carpet Base,2,3.0
"Teaser Ball Dog Toy 6""",2,1.0
"North American Pet Sisal Post 26""",2,3.0
EHEIM Fine Filter Pad (White) for Classic External Filter 2213 (3 Pieces),2,5.0
EHEIM Fine Filter Pad (White) for Classic External Filter 2215 (3 Pieces),2,5.0
New 4 Wheel Deluxe Pet Stroller Black,2,5.0
EHEIM Fine Filter Pad (White) for Classic External Filter 2217 (3 Pieces),2,5.0
Nupro Joint Supplement 30 oz.,2,5.0
Arm's Reach Co-Sleeper Pet Bunk Bed Plush Liner,2,4.5
New England Patriots Premium Large Dog Collar,2,4.5
TOM Critter Habitats Kreature Kingdom Lg Rectangle 14-1/2 x 8-5/8 x 9-1/2 3.6 gals,2,4.5
TOM Stellar Air Pump S-10 -10gal to 20gal tank,2,4.0
New Life Spectrum Cichlasoma 150g,2,5.0
New Life Spectrum Cichlasoma 300g,2,5.0
"NoztoNoz X-42 Sof-Krate, Gray",2,5.0
TOM Stellar Air Pump W-60 - 60gal to 100gal tank,2,3.0
Novpearls Dandruff Shampoo 12 Ounce Package - Part #: 292,2,5.0
Novartis Program for Dogs & Puppies 46-90-lbs (White),2,4.0
Novartis Program for Cats 1-10-lbs (Orange),2,5.0
New Life Spectrum Discus 300g,2,4.5
Easy Clean Litter Mat - Multi Stripe - Large - 23 in. x 26 in.,2,4.0
New Life Spectrum Marine Formula - 300 g,2,5.0
EJay ID 10 inch Bands 500ct Mixed Colors,2,4.0
Notoco 1408 PETSCOPE Ear Scope Otoscope,2,4.5
East Side Collection Think Pink Sweaters - X-Small,2,2.5
New Life Spectrum Surface Feeder 140g,2,4.5
ETHICAL DOG - Silent Brass Whistle,2,1.0
TREX CALCI SAND GLO 5LB 5CS,2,5.0
TRIFORCE CAT 2.2-5LB 3PK ?,2,2.5
EVICT LIQ WORMER PUP/DOG 2OZ 2X,2,5.0
TUBIFEX WORMS,2,2.5
North State Industries 8625 Pet Gate,2,1.5
"Tetra Min Granules, 1.20-Ounce, 85-Ml",2,3.5
"SynoviG3 EQ, 240 Soft Chews**",2,3.0
Ocean Nutrition Formula Two Flake 5.5 oz,2,3.0
"Natural Balance Organic Formula Dry Dog Food, 5-Pound Bag",2,4.5
Anti-Itch Spray for Cats - 4 oz,2,4.5
Natural Balance Dog Food Beef Roll And Lamb Roll,2,4.5
Antibacterial Shampoo - 12Oz,2,3.5
Embrace Food Baby Bird Hand Feeding Formula Size : 5 Pounds,2,5.0
OSI Brine Shrimp Eggs 15oz,2,5.0
"ORRCO 76203 TIE OUT STAKE 16"" [Misc.]",2,5.0
TetraMin Tropical Tablets Fish Food,2,5.0
Sweet Dreams Dog Pajamas Red Medium,2,4.5
OMEG WHACKY MOUSE POM POM TOY,2,5.0
Natural Balance Limited Ingredient Potato & Duck Dog Treats 14-oz bag,2,5.0
"Tetra test Oxygen Kit, 30-Pack",2,4.5
Natural Balance Organic Formula Dry Dog Food 5-lb bag,2,5.0
"Elite Optima Diaphragm Set for Optima Aquarium Air Pump, 2-Pack",2,5.0
"Elite Mist Air Stone, 3-Pack",2,4.5
Natural Balance Pet Food Dog Food Rolls Beef -- 2.75 oz,2,3.0
"Nylon Breakaway Cat Collars by Guardian Gear, Type: RED",2,1.0
"Aspen Pet X-Small 2 Knot Yummy Rope Bone, Steak Flavored",2,3.0
"Aspen Pet Medium 2 Knot Yummy Rope Bone, Steak Flavored",2,5.0
Natural Balance Roll - 1 lb Beef/Rice,2,4.5
Tetra Water Wonders Plants Value Pack 4,2,3.0
Aspen Pet Dog Tie Out - 10' for Dogs up to 25 pounds.,2,4.0
Donkey Pinata 8&#34; (Treat Filled) Bird Toy,2,5.0
"Natural Balance Turkey Formula Dog Food Roll, 2.5-Pound",2,4.5
Aspen Pet Booda Softbite Hamburger Plush Medium Dog Toy,2,4.5
Nylon Lead - 3/8 X 4 - Black,2,4.5
Nylon Holt Control Harness 14,2,5.0
Aqua Tank Betta - Penn plax beta bow front cubed tank,2,2.0
Synbiotics ASSURE FeLv Leukemia Virus Antigen Test Kit,2,5.0
Tetra Usa ATS29556 Whisper Repair Kit for 700 and 800 Air Pump,2,5.0
Synergy Anti-Allergen Mousse For Cats & Kittens,2,2.5
"Emperor Bio Wheel Bearings for Eclipse 1, 2 & 3",2,5.0
Natural Balance Beef Formula Dog Food Roll (1 lb.),2,5.0
Swagman Pooch Guard Pet Barrier,2,1.0
Enameled Wire Muzzle #10,2,3.5
Superpet (Pets International) Ferret Connector - White 2Pk,2,2.5
Oatmeal Spray 16 oz by Kenic,2,5.0
"Epi-Otic Ear Solution, 4 oz.",2,5.0
Oat Groats for Parakeets - 7 oz.,2,5.0
Superpet Pets International Corner Litter Scoop Bunny,2,3.5
Oakland Living 2 Crane Lily Bird Bath,2,3.5
Superpet Pets International Tropical Fiddle Sticks Small,2,5.0
Enzymatic Toothpaste - Beef,2,4.5
NaturVet Kelp Help - 4 lb. Powder,2,5.0
OUT! Pet Stain & Odor Remover Spray,2,5.0
Annamaet Glycocharge Post Exercise Carbohydrate Supplement,2,5.0
The BigFoot : Color BEIGE,2,5.0
"NaturVet OdoKleen Deodorizing Cleaner, Gallon",2,5.0
NaturVet Off Limits! Natural Pet Repellent for Canines and Felines,2,1.5
"Enforcer Flea and Tick Shampoo, 16-Ounce",2,3.0
Enforcer Flea PFC16 Killer For Carpets With Potpourri Rug Deodorizer,2,5.0
"OUT! Cat Bathing Wipes, 7 Count",2,3.0
"NaturVet Quiet Moments Powder, 55 Gram - CAT",2,1.5
OSI Spirulina Pellets Small,2,5.0
Anole Food for Small Lizards,2,1.5
"NaturVet Stool Deodorizer Plus , 60 Tabs",2,3.0
Encore Rabbit Food,2,5.0
Assorted Compressed Rawhide Bones Dog Treat,2,4.5
OSI Shrimp Pellets ts 7.5oz,2,5.0
"NaturVet TR VitaPet Senior Tablets, 60 Count",2,4.0
"Sure Clot for Dogs, Cats and Birds - 1/2 ounce",2,5.0
Ant and Bug Free Pet Food and Water Bowl - Backyard Green,2,4.0
The Antser Ant-Proof Barrier (Hunter Green),2,5.0
"Sureflexx - 4"" Red",2,5.0
"Natural Balance Ultra Premium Formula Dog Food, 5-Pound Bag",2,4.0
Nylaring Dog Toy,2,5.0
"SynoviCRE, 600/500mg for Medium and Large Dogs, 120 Tablets",2,5.0
"Synergy Veterinary Formula Blue Aloe Gel Shampoo, 34 Ounce",2,4.0
Nature Zone Cricket Total Bites Gutload 24oz,2,5.0
"Synergy Puppy Love Shampoo, 17 Ounce",2,5.0
Dr Harvey's Our Best Parakeet Food,2,5.0
"Dr-Chew Sweet Potato Chews, Small, 1 lb.",2,5.0
Tetra Pond Bottom Drain,2,4.5
Eight In One Products K777/1 Excel Brewers Yeast with Garlic 600 tabs for Dogs and Cats,2,5.0
"Dr. Chew, The Original - Large - 1 lb (7 - 10 pieces for dogs over 50 lbs.)",2,5.0
"Dr. Chew, The Original - Regular - 1 lb (14 - 17 pieces for dogs 20 - 50 lbs)",2,5.0
Nature Zone Sheet Moss Medium,2,3.5
Dr. Goodpet Flea Relief 1 oz,2,5.0
Dr. Noys Sitting Frog dog Toy - Small,2,5.0
Nature Zone Tortoise Bites,2,5.0
Nylabone Bar-B-Chew Rib Rack Chew Dog Toy,2,1.0
Arthramine Max Performance for Dogs - 60 count,2,4.5
"Tetra Pond Barley & Peat Extract, 16.9 Ounces, Treats 2, 500 Gallons",2,3.0
Natural Balance Ultra Premium Formula For Dogs,2,5.0
Nuzzle Nest Pet Bed X-Large,2,3.0
Nutro Ultra Weight Management - 15 lb,2,5.0
Nature Zone Turtle Fungus Bath 2oz,2,5.0
Nature Zone Waterdrip Vine 30 - 36in,2,3.0
"Synergy Veterinary Formula Ultra-Fluff Conditioning Shampoo, 17 Ounce",2,5.0
AquaClear Intake Stem for Power Filters,2,5.0
Dream PJ's Blue - Extra Large - Part #: 25BXL,2,4.5
Nutro Natural Choice Senior - Biscuits - 23 oz,2,5.0
"SynergyLabs Shed-X Dermaplex Anti-Oxidant for Cats, 8-Ounce",2,5.0
Dream PJ's Blue - Extra Small - Part #: 25BXS,2,4.0
Nutro Natural Choice Lite Adult Dog Biscuits,2,4.0
"Tetra Min Granules, 3.52-Ounce, 250-Ml",2,5.0
Arthogen for Dogs,2,4.5
Nutro Natural Choice Large Breed Adult - Chicken & Rice - 17.5 lb,2,5.0
Douxo - Maintenance Shampoo for DOGS & CATS (16.9 fl oz),2,5.0
Synergy Puppy 17-Ounce Fresh Shampoo,2,4.0
Nature Zone Aquatic Turtle Bites 2oz,2,3.0
"AquaClear 70 Ammonia Remover, 12.2 Ounce",2,3.0
Synergy Cage Wizard Bird Cage 16 Ounce,2,5.0
Natural Balance Venison & Green Pea Ultra Premium Canned Cat Food,2,4.5
Natural Chemistry De Flea Area Trigger Spray 22oz.,2,5.0
Tetra USA Inc Pro Trop Crisps 3.86Lbs,2,5.0
Dosko Sport Pet Porter,2,4.0
Aspen Pet Booda Bone Roasted Chicken Flavor Small 3pack,2,4.0
"Nylabone Rhino Chew Souper 8 1/2""",2,5.0
"Doskocil manufacturing co, inc - Petmate Medium Green Double Door Deluxe Kennel - 23 X 14 X 12",2,5.0
Artificial Tears Solutions,2,1.0
"Natural Choice Senior Lamb and Rice Recipe Chunks in Gravy Dog Food Cans, 12-1/2-Ounce",2,3.0
Arthur's Doggie Paw Wipes,2,5.0
AquaClear 110 Zeo-Carb Insert,2,5.0
"AquaClear 20 Ammonia Remover, 2.1 Ounce",2,5.0
Natural Faux Suede Dog Coat,2,3.0
"Tetra ReptoGuard Water Conditioner, 1-Block",2,5.0
"Synergy Groomer's Blend Pure & Simple Shampoo, 17.3 Ounce",2,5.0
Synergy Labs Pooch Scents Rain Fresh,2,5.0
Synergy Labs Pooch Scents Stud Muffin for Dogs,2,3.0
Synergy Labs Shed-X Dog,2,5.0
"Synergy Neem Oil Shampoo, 17 Ounce",2,5.0
Natural Pig Ears - Case/100,2,4.5
"Tetra Pond Sticks, 1.00-Pound, 4-Liter",2,5.0
Natural Pig Ears - Pack of 25,2,4.5
"Synergy NutriSauce Herb Roast Chicken Flavor For Dogs, 19 Ounce",2,2.0
"Synergy Oatmeal Protein Conditioner, 17 Ounce",2,5.0
"Double Ply Nylon Traffic Leads - Without Panic Snap Red 24""",2,4.5
"Synergy Odor Patrol, 16 Ounce",2,5.0
Natural Toothpaste - 2-1/2 oz.for dogs,2,5.0
"Nylabone Flexi Chew Tug Dog Toy, Original Flavor",2,4.5
Tap Water Filter Replacement Cartridge,2,5.0
Heath Outdoor Products 493M Silver Sky Mixed Seed,2,5.0
"Ornabac Bird Supplement, 15gm",2,5.0
Seachem Marine Buffer 500grams,2,5.0
Seaweed Select Green Algae with Garlic - 4 sheets,2,2.5
Seaweed Select Brown Algae with Garlic - 10 sheets,2,5.0
Seatec Phyto Greens Canine Wellness Formula - 16 oz,2,5.0
Seaflor Special Grade Reef Sand (40 lbs),2,4.5
Chem-marin Stop Aiptasia 6oz,2,4.5
Seachem Reef Status Magnesium Test Kit,2,5.0
Seachem Reef Status Calcium Test Kit,2,3.0
Pounce Crunchy Treats - Chicken & Turkey- 4.5 oz,2,5.0
Pounce Moist Chicken Treats - 3 oz,2,3.5
Cheese Wedge Box of 24 Fur Mice Cat Toys,2,4.0
Branch Coral - Natural - 6 in. x 4 1/2 in. x 5 in.,2,3.5
Brand New 3 Levels Ferret Chinchilla Hamster Cages 32x20x39 --- F3Stand,2,5.0
"Brand New 30"" Dog Cat Pet Soft Kennel Travel Cage Carrier - PH30",2,4.0
Charming Large Jingle Bells Party Collar,2,4.5
Seachem Plant Pack Fundementals (Box of 3 different 100ml Items),2,4.5
Precise Feline Foundation Chicken Natural Formula for Adult Cats,2,5.0
Brand New Bird Cage Cages 18x18x54 With Stand 5944Wht/S,2,5.0
Seachem MultiTest Iron Test Kit,2,2.5
Seachem MultiTest Iodine and Iodide Test Kit,2,2.5
Brand New Bird Sugar Glider Ferret Cage 30x18x59 1x94_14AS,2,5.0
Cerulytic Ear Cleanser 4oz,2,5.0
"Precision Pet 3-Door Deluxe Great Crate, Sterling, Up to 25 Pounds",2,4.5
Seachem Matrix Carbon 2 Liters,2,4.5
"Precision Pet Chrome Great Crate 19x12x15""",2,4.5
"Precision Pet Chrome Great Crate 42x28x31""",2,5.0
Seaweed Select Red Algae with Garlic - 10 sheets,2,5.0
"Poop-Off Superior Stain and Odor Remover Refill for Dogs and Puppies, 128-Ounce",2,2.0
"Poop-Off All Marine Bird Poop Remover Brush Top, 16-Ounce",2,1.0
PondCare Wide Range PH Test Kit,2,5.0
Sergeant's Vetscription 4-Ounce Antimicrobial Wound Cream Dog,2,5.0
"Sergeant's Seasons Treatings Candy Cane Dog Biscuit, 23 Ounce",2,3.0
"PondCare 140D Stress Coat, 64-Ounce",2,5.0
Boundary Indoor/Outdoor Repellent for Dogs and Cats,2,1.5
Chilly Bone Vanilla Flavored (Small),2,2.5
"PondCare Accu-Clear Water Clarifier, 16-Ounce",2,3.0
"PondCare Accu-Clear Water Clarifier, 8-Ounce",2,3.0
Chicken and Banana Dog Treat,2,5.0
PondCare EcoFix 1 gallons,2,5.0
Chicken Soup for the Dog Lover's Soul Adult Dog Formula,2,5.0
"PondCare Summer Staple Pellet Fish Food, 20-Ounce",2,5.0
Chicken Soup For The Cat Lover's Soul Light Cat Formula,2,5.0
Seed Guard - Nylon Mesh - White - Small,2,5.0
Chicken Breast Nibblets - Cats,2,2.5
"Bowsers Double Donut Dog Bed in Milano Microvelvet (Milano, Medium (35in x 27in))",2,3.5
Pooch Pads Reusable Housebreaking Pad,2,3.0
Sentry HC Nutrimalt 2oz,2,5.0
Pooch Pants - Small,2,4.5
Pooch Passions Freeze Dried Chicken Liver Treats - 3 oz,2,5.0
Pooch Passions Freeze Dried Liver Dog Treat Quantity: 4-oz,2,4.5
"Pooch+PlusTM Starburst Regal Red Sweater / Small 8"" - 12""",2,5.0
Self Cleaning Slicker Brush Size: Small,2,5.0
Selcon Vitamin Supplement - 60 mL,2,5.0
"Seio super Flow Aqua Pump, 1100-Gallon Per Hour",2,4.0
Brand New Dog Cat Pet Kennel Travel Crate Cage Carrier Z100L-Pink,2,3.0
Precision Pet Little Stinker Housebreaking Pet Pads,2,3.0
"Petmate Ultra 10 Pound Auto Feeder, Colors may Vary",2,4.0
Seachem Hypersorb 100ml,2,5.0
Brand New Parrot Bird Cage Cages Play W/Stand On Wheels 20x20x58-600HCHR,2,4.0
"Brand New Parrot Bird Cage Cages Play W/stand on Wheels 20x20x58, Blue",2,5.0
Brand New Parrot Bird Wrought Iron Cage Dome-Top 24x22x58-WI24ASR,2,3.0
Cat Pan Liners 10 Pack,2,5.0
Brand New Rodent Gerbil Mouse Mice Critter Cage H1010BLUE,2,2.0
Cat Nip Wool Mouse 2Pk,2,3.0
"Cat Nail Clipper, Styptic & File 3-in-1 Pedicure Set",2,3.0
Premium Bird Food for Cockatiels - 3 lb.,2,5.0
Braunamid Synthetic Suture / Needle Combinations - 45 cm - 0 - Heavy,2,5.0
Savory Prime Never-Hair Pick Up Roller Refills,2,3.5
Cat Harness 8 3/8X14 Blue,2,2.0
Cat Grass Plus 5.25 oz,2,2.5
Save A Seat - Car seat protection,2,3.5
"Sassafras Cat Treat Mini Bag, Tuna",2,2.0
Sardex II,2,3.0
Breeder's Choice Avoderm Cat & Kitten Beef Formula,2,5.0
Preppy Tennis Sweater - MD Powder Pink,2,4.0
Preppy Tennis Sweater - MD Red,2,3.5
Preppy Tennis Sweater - SM Red,2,3.0
Pressurized Filter UV Lite,2,5.0
Brewer's Yeast & Garlic 25 lb powder,2,4.0
Sanitary Dog Pants XLarge 23.25 x 27,2,4.0
Sanitary Dog Pants Medium 12.5 x 15.25,2,2.5
Cat Dental Care Kit,2,3.5
Pretty Bird Birdy Banquet 8 lbs,2,3.5
Scratch N' Perch (124102B),2,3.5
"Cat Tails Unscented Cat Litter, 25 Pound Bag",2,3.0
"Premier Pet Pet KeepSafe 3/4-Inch Small Break-Away Dog Collar, Red",2,4.0
Premier Chipmunk Plush Dog Toy,2,3.0
Seachem Garlic Guard,2,1.0
Seachem Focus 5gram,2,3.0
Seachem Flourish Trace Elements 500mL,2,5.0
Cayman 1 Small Animal Carrier - Small - Blue,2,5.0
"Brand New Fleece Pet Bed/ Crate Pad for Cats and Dogs 42""x26""---4226",2,4.5
Cats Rule Perfect Litter Mat Brilliantly Clear Circles,2,4.0
Cats Rule Max's Box - Heart Closed Box Freshwater,2,4.0
"Precision Pet Two-Door Great Crate, Small 2000, 24 x 18 x 20"", Chrome",2,5.0
Cats Rule Charlie's Box - Cat Face Closed Box Steel,2,3.0
Seachem Discus Buffer 500gram,2,4.5
Cats Rule 00571 Perfect Litter Mat - Multi Stripe,2,4.5
"Cats Claw Teaser Small Fluffy feathers, approx 24 in. w/mylar",2,1.5
Brand New Hamster Rodent Gerbil Mouse Mice Critter Cage - H3294Blue,2,2.0
"Cats Claw Teaser Mylar streamers, approx 24 in.",2,5.0
Seachem Cupramine Copper 250ml,2,3.0
"Premier Gentle Leader Calming Cap, Sizes: Medium",2,4.5
Seachem Cichlid Trace Elements 500ml,2,5.0
Seachem Betta Basics 250ml,2,2.5
Brand New Hamster Rodent Gerbil Mouse Mice Critter Cage - 167 Pink,2,3.0
"Catit Food Dish Replacement for Design Fresh and Clear Cat Drinking Fountain, White",2,3.0
Catheter Tip 35 cc Syringe,2,4.5
SeaClear Eclipse 2 Compatible Aquarium,2,3.5
"Cat's Pride Complete Multiple Cat Formula Clay Litter, 20-Pound Bag",2,1.0
"Premier Pet Pet KeepSafe 1-Inch Medium Break-Away Dog Collar, Black",2,3.5
Sergeant's Vetscription 4-Ounce Hydrocortisone Spray Dog and Cat,2,5.0
"Sergeant's Vetscription Sure Shot 2X Liq Wormer Dog up to 120-Pound, 2-Ounce",2,3.0
Sergeants Skip-flea and Tick Shampoo For Cats 18 fl oz,2,2.5
Shaft and Bushings for Eheim 2211 and 2213 Canister Filters,2,4.0
Petsport USA Laser Chase,2,2.0
Claws Tank Tongs - 20 in.,2,1.5
"Blue Buffalo Dry Dog Food, Lamb and Rice Recipe, 6-Pound Bag",2,4.0
"Classic Products Plastic Double Grill Basket Muzzle with Nylon Collar, Size 9",2,3.5
"Classic Products Plastic Double Grill Basket Muzzle with Nylon Collar, Size 5",2,3.0
Blue Mini Pet Paws Pet Carrier Fashion Bag,2,5.0
"Classic Products Plastic Double Grill Basket Muzzle with Nylon Collar, Size 2",2,4.5
Classic Products Mikki Pill Gun #Pp1,2,3.0
Classic Products Lightweight Dog Muzzle 5,2,4.5
Petstages Orka Tube,2,1.0
Petstages Shake Rattle and Roll,2,3.5
"Classic Products Groomaster Greyhound-Style Comb, Fine/Medium, 4-1/2-Inch",2,2.0
Petstep 485 Vinyl Carrying Bag,2,5.0
Petstep 560 PetSTEP Flotation Kit,2,2.5
Petvoyage Pet Voyage Sports Carrier On Wheels - Black,2,3.0
Petzip-Walkie Pet Stroller,2,1.0
Philadelphia Phillies Baseball Dog Puppy Pet Bandana - Medium/Large Officially Licensed MLB,2,5.0
"PhosGuard, 2 L / 67.6 oz.",2,5.0
"PhosGuard, 4 L / 1 gal.",2,5.0
"Pigeon & Dove Staple VME Seeds, 3 Pounds",2,4.5
Pill Pockets SMALL 3.2 oz (30 Beef pockets),2,5.0
Pill Pockets SMALL Dog 3.5 oz,2,5.0
Classic Max-4 Camo Deluxe Kennel Jacket,2,5.0
Classic Dog: Beef 8kg,2,5.0
Classic Cable Sweater - 8Bkxl - Bci,2,3.5
Petsport Pack My Bowl (Colors May Vary),2,4.5
Clean Life Stand,2,4.0
Clean N' Care - 14 oz,2,5.0
Petrodex Toothpaste for Dogs - 70 grams,2,4.5
"Coastal Li'l Pals Pink Kitten Collar with Bow and Bell, Small",2,2.5
Skins Ball Leopard Dog Toy Size: Medium,2,5.0
"Coastal Best Fit Mesh Muzzle, Size 8, 11.5 inch nose",2,3.0
Skin & Coat Treats,2,3.0
"Coarse Filter Pads for 2232, 2234 and 2236 ECCO Filters - 3 pk",2,5.0
Co2 Refill Pack,2,1.5
Co2 Bubble Counter,2,3.0
Blu-Mist Airstone for Aqariums - 4 In,2,4.5
Petrodex Dental for Cats with Breath Fresheners,2,3.0
"Cloud Star Buddy Biscuits Dog Treats, 16oz Box, Peanut Butter",2,5.0
Petrodex Dual Ended Dog Toothbrush,2,5.0
Petromalt 2-1/2-Ounce Hairball Remedy Treatment,2,5.0
Petsport Fetch Me Fido,2,1.0
Petromalt Fiber Capsules for Cats,2,4.5
Petromalt Hairball Relief- 2 oz Tube,2,3.0
"Petromalt Hairball Remedy, Fish Flavor (2 oz.)",2,3.0
Pets First Clemson University Dog Sweater,2,4.5
Single Thick Nylon Dog Collar in Hot Purple,2,4.0
Pets Prefer Joint Plus for Dogs - 60 ct,2,5.0
Single Thick Nylon Deluxe Dog Collar in Red,2,3.0
Cliffs and Caves Master Kit - Large - 6 x 7 x 3 in. - Small - 4 x 2 1/2 x 1/2,2,3.0
Single Thick Nylon Deluxe Dog Collar in Blue,2,3.0
Clear-free Air Cartridge Filter - Up to 10 gal.,2,2.0
"Clear Pond Beneficial Bacteria Liquid, 8-Ounce",2,3.5
"Classic Accessories Pet Rear Seat Protector (Fits Almost Any Car, Mini Van, Or SUV)",2,4.0
"Pinch Collars Light, 2.25mm, 8 links x 1 in. each",2,5.0
"Pine Tree Farms 1110 Suet Peanut Butter Cake, 12-Ounce",2,5.0
Plato Organic Chicken Strips Dog Treats,2,5.0
Chris Christensen Mark I Slicker Brush ( X Small),2,5.0
Plant Air Tubing - 60 in.,2,4.5
Booda Squatters Bunny Dog Toy,2,5.0
Sherpa Original Bag Deluxe,2,5.0
Sherpa Montreal Pet Tote - Red Faux Alligator / Standard,2,5.0
Plants+Plus Large Hygrophilia,2,4.5
Chris Christensen Day to Day Shampoo 16 oz,2,5.0
"Chris Christensen After Bath Final Rinse, 16 oz.",2,5.0
Platinum Microvelvet Cozy Couch Blanket - Saddle,2,5.0
"Booda Wonder Tug Twin Dog Toy, Colors Vary",2,2.5
Chris Christensen - WHITE ON WHITE Shampoo,2,4.0
Plato Organic Chicken Strips Smart Dog Treats 16-oz,2,5.0
